link_producto,producto,asin,precio,precio_original,vendidos_mes_pasado,calificación,num_de_calificaciones,imagen,vendidos_numerico
https://www.amazon.com/-/es/Cargador-retr%C3%A1ctil-autom%C3%B3vil-adaptador-compatible/dp/B0D4215HCX/ref=sr_1_1?dib=eyJ2IjoiMSJ9.ZvwoN-i8FFuSi3WgF40HuSZL8PLTBLGBQaE8OUlPfTQWDuWf8JSJeeZURhzbua5r8TWYmjjwXTDhWla4WR88RGlSkHxgOtcknldyWVq6o-AvyvTwGSvnLhbPAt0ux7PRoJV8-g2RmR5hc-7QCSNycuuIW1vmgixaU5u9ZVU2sgBx7XPEhW9nYOlQ08Y_GFl6tNS9mm9sa6Vq7ArRXXooU2ErhEslw58m5OAas7blV_E.Mi-m3PKb1c0PxCVJVpFa0xPmlzlUAYCyZcnCL0b97Xo&dib_tag=se&keywords=Electr%C3%B3nicos&qid=1725876194&sr=8-1,"LISEN Cargador retráctil para automóvil [adaptador de cargador de coche USB de 69 W], teléfono de carga rápida 4 en 1, carga de teléfono retráctil para automóvil compatible con iPhone 15/14/13/12/11,",B0D4215HCX,19.99,Sin información,10 K+ comprados el mes pasado,4.5,200,https://m.media-amazon.com/images/I/71R6ka8Os4L._AC_UY218_.jpg,10000.0
https://www.amazon.com/-/es/comprimido-engranajes-soplador-inal%C3%A1mbrico-enlatados/dp/B0D5BDNR8R/ref=sr_1_2?dib=eyJ2IjoiMSJ9.ZvwoN-i8FFuSi3WgF40HuSZL8PLTBLGBQaE8OUlPfTQWDuWf8JSJeeZURhzbua5r8TWYmjjwXTDhWla4WR88RGlSkHxgOtcknldyWVq6o-AvyvTwGSvnLhbPAt0ux7PRoJV8-g2RmR5hc-7QCSNycuuIW1vmgixaU5u9ZVU2sgBx7XPEhW9nYOlQ08Y_GFl6tNS9mm9sa6Vq7ArRXXooU2ErhEslw58m5OAas7blV_E.Mi-m3PKb1c0PxCVJVpFa0xPmlzlUAYCyZcnCL0b97Xo&dib_tag=se&keywords=Electr%C3%B3nicos&qid=1725876194&sr=8-2,"Plumero de aire comprimido, 3 engranajes a 100000 RPM, soplador de aire inalámbrico portátil con luz LED, para limpieza de teclado y PC, kit de limpieza de aire, sin plumeros de aire enlatados,",B0D5BDNR8R,29.98,Sin información,2 K+ comprados el mes pasado,4.6,236,https://m.media-amazon.com/images/I/719F4I7zVYL._AC_UY218_.jpg,2000.0
https://www.amazon.com/-/es/Computadora-port%C3%A1til-almacenamiento-microborde-Microsoft/dp/B0947BJ67M/ref=sr_1_3?dib=eyJ2IjoiMSJ9.ZvwoN-i8FFuSi3WgF40HuSZL8PLTBLGBQaE8OUlPfTQWDuWf8JSJeeZURhzbua5r8TWYmjjwXTDhWla4WR88RGlSkHxgOtcknldyWVq6o-AvyvTwGSvnLhbPAt0ux7PRoJV8-g2RmR5hc-7QCSNycuuIW1vmgixaU5u9ZVU2sgBx7XPEhW9nYOlQ08Y_GFl6tNS9mm9sa6Vq7ArRXXooU2ErhEslw58m5OAas7blV_E.Mi-m3PKb1c0PxCVJVpFa0xPmlzlUAYCyZcnCL0b97Xo&dib_tag=se&keywords=Electr%C3%B3nicos&qid=1725876194&sr=8-3,"HP Computadora portátil 14, Intel Celeron N4020, 4 GB de RAM, 64 GB de almacenamiento, pantalla HD de microborde de 14 pulgadas, Windows 11 Home, delgada y portátil, gráficos 4K, un año de Microsoft",B0947BJ67M,183.49,Sin información,4 K+ comprados el mes pasado,3.9,1661,https://m.media-amazon.com/images/I/815uX7wkOZS._AC_UY218_.jpg,4000.0
https://www.amazon.com/-/es/exteriores-actualizado-compatible-inteligente-sincronizaci%C3%B3n/dp/B099N4NSSD/ref=sr_1_4?dib=eyJ2IjoiMSJ9.ZvwoN-i8FFuSi3WgF40HuSZL8PLTBLGBQaE8OUlPfTQWDuWf8JSJeeZURhzbua5r8TWYmjjwXTDhWla4WR88RGlSkHxgOtcknldyWVq6o-AvyvTwGSvnLhbPAt0ux7PRoJV8-g2RmR5hc-7QCSNycuuIW1vmgixaU5u9ZVU2sgBx7XPEhW9nYOlQ08Y_GFl6tNS9mm9sa6Vq7ArRXXooU2ErhEslw58m5OAas7blV_E.Mi-m3PKb1c0PxCVJVpFa0xPmlzlUAYCyZcnCL0b97Xo&dib_tag=se&keywords=Electr%C3%B3nicos&qid=1725876194&sr=8-4,"Proyector con WiFi y Bluetooth, proyector para exteriores actualizado 2024, mini proyector de películas compatible con pantalla de teléfono inteligente de sincronización de 1080P por cable WiFi/USB",B099N4NSSD,89.99,Sin información,4 K+ comprados el mes pasado,4.3,4247,https://m.media-amazon.com/images/I/71bPcqUviTL._AC_UY218_.jpg,4000.0
https://www.amazon.com/-/es/Auriculares-auriculares-inmersivo-comodidad-conciencia/dp/B0CPFV77W4/ref=sr_1_5_mod_primary_new?dib=eyJ2IjoiMSJ9.ZvwoN-i8FFuSi3WgF40HuSZL8PLTBLGBQaE8OUlPfTQWDuWf8JSJeeZURhzbua5r8TWYmjjwXTDhWla4WR88RGlSkHxgOtcknldyWVq6o-AvyvTwGSvnLhbPAt0ux7PRoJV8-g2RmR5hc-7QCSNycuuIW1vmgixaU5u9ZVU2sgBx7XPEhW9nYOlQ08Y_GFl6tNS9mm9sa6Vq7ArRXXooU2ErhEslw58m5OAas7blV_E.Mi-m3PKb1c0PxCVJVpFa0xPmlzlUAYCyZcnCL0b97Xo&dib_tag=se&keywords=Electr%C3%B3nicos&qid=1725876194&sbo=RZvfv%2F%2FHxDF%2BO5021pAnSA%3D%3D&sr=8-5,"Bose Auriculares ultra abiertos, auriculares abiertos de audio inmersivo, auriculares con clip para mayor comodidad, auriculares para correr con OpenAudio para conciencia, hasta 48 horas de duración",B0CPFV77W4,299.0,Sin información,2 K+ comprados el mes pasado,3.9,1787,https://m.media-amazon.com/images/I/51LyCgwzz9L._AC_UY218_.jpg,2000.0
https://www.amazon.com/-/es/JBL-Tune-Flex-Auriculares-inal%C3%A1mbricos/dp/B0C1QNRGHC/ref=sr_1_6?dib=eyJ2IjoiMSJ9.ZvwoN-i8FFuSi3WgF40HuSZL8PLTBLGBQaE8OUlPfTQWDuWf8JSJeeZURhzbua5r8TWYmjjwXTDhWla4WR88RGlSkHxgOtcknldyWVq6o-AvyvTwGSvnLhbPAt0ux7PRoJV8-g2RmR5hc-7QCSNycuuIW1vmgixaU5u9ZVU2sgBx7XPEhW9nYOlQ08Y_GFl6tNS9mm9sa6Vq7ArRXXooU2ErhEslw58m5OAas7blV_E.Mi-m3PKb1c0PxCVJVpFa0xPmlzlUAYCyZcnCL0b97Xo&dib_tag=se&keywords=Electr%C3%B3nicos&qid=1725876194&sr=8-6,"JBL Tune Flex - Auriculares inalámbricos con cancelación de ruido (negro), pequeños",B0C1QNRGHC,49.95,Sin información,10 K+ comprados el mes pasado,4.1,5119,https://m.media-amazon.com/images/I/61joErBxERL._AC_UY218_.jpg,10000.0
https://www.amazon.com/-/es/Skylight-Calendario-inteligente-interactiva-familiares/dp/B0C9V811L6/ref=sr_1_7?dib=eyJ2IjoiMSJ9.ZvwoN-i8FFuSi3WgF40HuSZL8PLTBLGBQaE8OUlPfTQWDuWf8JSJeeZURhzbua5r8TWYmjjwXTDhWla4WR88RGlSkHxgOtcknldyWVq6o-AvyvTwGSvnLhbPAt0ux7PRoJV8-g2RmR5hc-7QCSNycuuIW1vmgixaU5u9ZVU2sgBx7XPEhW9nYOlQ08Y_GFl6tNS9mm9sa6Vq7ArRXXooU2ErhEslw58m5OAas7blV_E.Mi-m3PKb1c0PxCVJVpFa0xPmlzlUAYCyZcnCL0b97Xo&dib_tag=se&keywords=Electr%C3%B3nicos&qid=1725876194&sr=8-7,"Skylight Calendario: Calendario digital de 15 pulgadas y gráfico de tareas, pantalla táctil inteligente interactiva para horarios familiares - montaje en pared incluido",B0C9V811L6,309.98,Sin información,10 K+ comprados el mes pasado,4.4,948,https://m.media-amazon.com/images/I/61kdlvrgoUL._AC_UY218_.jpg,10000.0
https://www.amazon.com/-/es/muscular-masajeador-el%C3%A9ctrico-dispositivo-percusi%C3%B3n/dp/B09P1DV7D8/ref=sr_1_8?dib=eyJ2IjoiMSJ9.ZvwoN-i8FFuSi3WgF40HuSZL8PLTBLGBQaE8OUlPfTQWDuWf8JSJeeZURhzbua5r8TWYmjjwXTDhWla4WR88RGlSkHxgOtcknldyWVq6o-AvyvTwGSvnLhbPAt0ux7PRoJV8-g2RmR5hc-7QCSNycuuIW1vmgixaU5u9ZVU2sgBx7XPEhW9nYOlQ08Y_GFl6tNS9mm9sa6Vq7ArRXXooU2ErhEslw58m5OAas7blV_E.Mi-m3PKb1c0PxCVJVpFa0xPmlzlUAYCyZcnCL0b97Xo&dib_tag=se&keywords=Electr%C3%B3nicos&qid=1725876194&sr=8-8,"Pistola de masaje, pistola de masaje muscular para atletas, masajeador eléctrico de espalda de tejido profundo, dispositivo de masaje de percusión para aliviar el dolor con 30 niveles de",B09P1DV7D8,29.99,Sin información,5 K+ comprados el mes pasado,4.4,11132,https://m.media-amazon.com/images/I/712UHB03CbL._AC_UY218_.jpg,5000.0
https://www.amazon.com/-/es/Alesis-Nitro-Max-Kit-almohadillas/dp/B0C43R8SRB/ref=sr_1_9?dib=eyJ2IjoiMSJ9.ZvwoN-i8FFuSi3WgF40HuSZL8PLTBLGBQaE8OUlPfTQWDuWf8JSJeeZURhzbua5r8TWYmjjwXTDhWla4WR88RGlSkHxgOtcknldyWVq6o-AvyvTwGSvnLhbPAt0ux7PRoJV8-g2RmR5hc-7QCSNycuuIW1vmgixaU5u9ZVU2sgBx7XPEhW9nYOlQ08Y_GFl6tNS9mm9sa6Vq7ArRXXooU2ErhEslw58m5OAas7blV_E.Mi-m3PKb1c0PxCVJVpFa0xPmlzlUAYCyZcnCL0b97Xo&dib_tag=se&keywords=Electr%C3%B3nicos&qid=1725876194&sr=8-9,"Alesis Nitro Max Kit - Juego de batería eléctrica con almohadillas de malla silenciosas, caja de doble zona de 10 pulgadas, Bluetooth, más de 440 sonidos auténticos, Drumeo, USB MIDI, pedal de patada",B0C43R8SRB,399.0,Sin información,900+ comprados el mes pasado,4.5,678,https://m.media-amazon.com/images/I/71bYhi2A-nL._AC_UY218_.jpg,900.0
https://www.amazon.com/-/es/Cargador-paquete-unidades-cargador-compatible/dp/B0D5TW839Q/ref=sr_1_10?dib=eyJ2IjoiMSJ9.ZvwoN-i8FFuSi3WgF40HuSZL8PLTBLGBQaE8OUlPfTQWDuWf8JSJeeZURhzbua5r8TWYmjjwXTDhWla4WR88RGlSkHxgOtcknldyWVq6o-AvyvTwGSvnLhbPAt0ux7PRoJV8-g2RmR5hc-7QCSNycuuIW1vmgixaU5u9ZVU2sgBx7XPEhW9nYOlQ08Y_GFl6tNS9mm9sa6Vq7ArRXXooU2ErhEslw58m5OAas7blV_E.Mi-m3PKb1c0PxCVJVpFa0xPmlzlUAYCyZcnCL0b97Xo&dib_tag=se&keywords=Electr%C3%B3nicos&qid=1725876194&sr=8-10,"Cargador USB C para iPhone, carga rápida, paquete de 3 unidades de 20 W, tipo C, cargador de pared con cable de carga USB C de 6 pies de largo, compatible con iPhone 14Pro/13 Pro/12/12 Pro Max/11/XS",B0D5TW839Q,12.99,Sin información,4 K+ comprados el mes pasado,4.5,505,https://m.media-amazon.com/images/I/51ktwFF4xXL._AC_UY218_.jpg,4000.0
https://www.amazon.com/-/es/LC-dolida-Auriculares-Bluetooth-inal%C3%A1mbrica-auriculares/dp/B07T6FNLQV/ref=sr_1_11?dib=eyJ2IjoiMSJ9.ZvwoN-i8FFuSi3WgF40HuSZL8PLTBLGBQaE8OUlPfTQWDuWf8JSJeeZURhzbua5r8TWYmjjwXTDhWla4WR88RGlSkHxgOtcknldyWVq6o-AvyvTwGSvnLhbPAt0ux7PRoJV8-g2RmR5hc-7QCSNycuuIW1vmgixaU5u9ZVU2sgBx7XPEhW9nYOlQ08Y_GFl6tNS9mm9sa6Vq7ArRXXooU2ErhEslw58m5OAas7blV_E.Mi-m3PKb1c0PxCVJVpFa0xPmlzlUAYCyZcnCL0b97Xo&dib_tag=se&keywords=Electr%C3%B3nicos&qid=1725876194&sr=8-11,"LC-dolida - Auriculares para dormir, máscara de dormir Bluetooth 3D inalámbrica con música para dormir de lado, máscara de dormir con auriculares Bluetooth, altavoces estéreo delgados regalos para hombres y mujeres",B07T6FNLQV,28.99,Sin información,7 K+ comprados el mes pasado,4.3,21882,https://m.media-amazon.com/images/I/81hJ4SQSJFL._AC_UY218_.jpg,7000.0
https://www.amazon.com/-/es/sspa/click?ie=UTF8&spc=MTo1MjgwMzEyNDIxMjkxMDE6MTcyNTg3NjE5NDpzcF9tdGY6MzAwMjA2MjIyNjg1MDAyOjowOjo&url=%2FProyector-el%25C3%25A9ctrico-exteriores-autom%25C3%25A1tico-inteligente%2Fdp%2FB0CXXVT4R5%2Fref%3Dsr_1_12_sspa%3Fdib%3DeyJ2IjoiMSJ9.ZvwoN-i8FFuSi3WgF40HuSZL8PLTBLGBQaE8OUlPfTQWDuWf8JSJeeZURhzbua5r8TWYmjjwXTDhWla4WR88RGlSkHxgOtcknldyWVq6o-AvyvTwGSvnLhbPAt0ux7PRoJV8-g2RmR5hc-7QCSNycuuIW1vmgixaU5u9ZVU2sgBx7XPEhW9nYOlQ08Y_GFl6tNS9mm9sa6Vq7ArRXXooU2ErhEslw58m5OAas7blV_E.Mi-m3PKb1c0PxCVJVpFa0xPmlzlUAYCyZcnCL0b97Xo%26dib_tag%3Dse%26keywords%3DElectr%25C3%25B3nicos%26qid%3D1725876194%26sr%3D8-12-spons%26sp_csd%3Dd2lkZ2V0TmFtZT1zcF9tdGY%26psc%3D1,"Proyector de enfoque eléctrico con WiFi 6 y Bluetooth 5.2, proyector 500 ANSI 4K, proyector de película nativo 1080P para exteriores, Keystone automático, pantalla táctil, proyector inteligente",B0CXXVT4R5,129.99,Sin información,Sin información,3.9,31,https://m.media-amazon.com/images/I/71MCEuEJF+L._AC_UY218_.jpg,
https://www.amazon.com/-/es/port%C3%A1til-autom%C3%A1tica-inal%C3%A1mbrico-autom%C3%B3vil-navegaci%C3%B3n/dp/B0DCBM6CMH/ref=sr_1_13?dib=eyJ2IjoiMSJ9.ZvwoN-i8FFuSi3WgF40HuSZL8PLTBLGBQaE8OUlPfTQWDuWf8JSJeeZURhzbua5r8TWYmjjwXTDhWla4WR88RGlSkHxgOtcknldyWVq6o-AvyvTwGSvnLhbPAt0ux7PRoJV8-g2RmR5hc-7QCSNycuuIW1vmgixaU5u9ZVU2sgBx7XPEhW9nYOlQ08Y_GFl6tNS9mm9sa6Vq7ArRXXooU2ErhEslw58m5OAas7blV_E.Mi-m3PKb1c0PxCVJVpFa0xPmlzlUAYCyZcnCL0b97Xo&dib_tag=se&keywords=Electr%C3%B3nicos&qid=1725876194&sr=8-13,"Carplay portátil de 9 pulgadas y pantalla táctil automática Android, estéreo inalámbrico para automóvil con cámara de tablero 4K, cámara de respaldo de 1080P, navegación GPS, enlace de espejo, control",B0DCBM6CMH,139.99,Sin información,100+ comprados el mes pasado,4.6,35,https://m.media-amazon.com/images/I/7140OczUpBL._AC_UY218_.jpg,100.0
https://www.amazon.com/-/es/Frameo-pulgadas-electr%C3%B3nico-rotaci%C3%B3n-autom%C3%A1tica/dp/B088NHSVJN/ref=sr_1_14?dib=eyJ2IjoiMSJ9.ZvwoN-i8FFuSi3WgF40HuSZL8PLTBLGBQaE8OUlPfTQWDuWf8JSJeeZURhzbua5r8TWYmjjwXTDhWla4WR88RGlSkHxgOtcknldyWVq6o-AvyvTwGSvnLhbPAt0ux7PRoJV8-g2RmR5hc-7QCSNycuuIW1vmgixaU5u9ZVU2sgBx7XPEhW9nYOlQ08Y_GFl6tNS9mm9sa6Vq7ArRXXooU2ErhEslw58m5OAas7blV_E.Mi-m3PKb1c0PxCVJVpFa0xPmlzlUAYCyZcnCL0b97Xo&dib_tag=se&keywords=Electr%C3%B3nicos&qid=1725876194&sr=8-14,"Frameo - Marco de fotos digital WiFi de 10.1 pulgadas, 1280 x 800 HD IPS, marco de fotos electrónico, 32 GB de memoria, rotación automática, montaje en pared, comparte fotos/videos al instante a",B088NHSVJN,69.99,Sin información,10 K+ comprados el mes pasado,4.5,4284,https://m.media-amazon.com/images/I/61O+aorCp0L._AC_UY218_.jpg,10000.0
https://www.amazon.com/-/es/MiracleWipes-Toallitas-electr%C3%B3nica-toallitas-microfibra/dp/B086GKB4SB/ref=sr_1_15?dib=eyJ2IjoiMSJ9.ZvwoN-i8FFuSi3WgF40HuSZL8PLTBLGBQaE8OUlPfTQWDuWf8JSJeeZURhzbua5r8TWYmjjwXTDhWla4WR88RGlSkHxgOtcknldyWVq6o-AvyvTwGSvnLhbPAt0ux7PRoJV8-g2RmR5hc-7QCSNycuuIW1vmgixaU5u9ZVU2sgBx7XPEhW9nYOlQ08Y_GFl6tNS9mm9sa6Vq7ArRXXooU2ErhEslw58m5OAas7blV_E.Mi-m3PKb1c0PxCVJVpFa0xPmlzlUAYCyZcnCL0b97Xo&dib_tag=se&keywords=Electr%C3%B3nicos&qid=1725876194&sr=8-15,"MiracleWipes - Toallitas para limpieza electrónica, toallitas para pantalla diseñadas para TV, teléfonos, monitores y más, incluye toalla de microfibra (60 unidades)",B086GKB4SB,16.97,Sin información,2 K+ comprados el mes pasado,4.4,19992,https://m.media-amazon.com/images/I/81Gal4m42WL._AC_UY218_.jpg,2000.0
https://www.amazon.com/-/es/proyector-port%C3%A1til-exteriores-tel%C3%A9fono-compatible/dp/B0CD2BS3QX/ref=sr_1_16?dib=eyJ2IjoiMSJ9.ZvwoN-i8FFuSi3WgF40HuSZL8PLTBLGBQaE8OUlPfTQWDuWf8JSJeeZURhzbua5r8TWYmjjwXTDhWla4WR88RGlSkHxgOtcknldyWVq6o-AvyvTwGSvnLhbPAt0ux7PRoJV8-g2RmR5hc-7QCSNycuuIW1vmgixaU5u9ZVU2sgBx7XPEhW9nYOlQ08Y_GFl6tNS9mm9sa6Vq7ArRXXooU2ErhEslw58m5OAas7blV_E.Mi-m3PKb1c0PxCVJVpFa0xPmlzlUAYCyZcnCL0b97Xo&dib_tag=se&keywords=Electr%C3%B3nicos&qid=1725876194&sr=8-16,"Mini proyector, proyector de video VISSPL Full HD 1080P, proyector portátil para exteriores con trípode, regalo para niños, cine en casa, proyector de teléfono compatible con Android, iOS, Windows, TV",B0CD2BS3QX,49.99,Sin información,1 K+ comprados el mes pasado,4.3,1558,https://m.media-amazon.com/images/I/61kRNDZh8UL._AC_UY218_.jpg,1000.0
https://www.amazon.com/-/es/sspa/click?ie=UTF8&spc=MTo1MjgwMzEyNDIxMjkxMDE6MTcyNTg3NjE5NDpzcF9tdGY6MzAwMzk5MzMzMzE0ODAyOjowOjo&url=%2Felegible-masajeadora-profundo-percusi%25C3%25B3n-el%25C3%25A9ctrica%2Fdp%2FB0D14N8B5M%2Fref%3Dsr_1_17_sspa%3Fdib%3DeyJ2IjoiMSJ9.ZvwoN-i8FFuSi3WgF40HuSZL8PLTBLGBQaE8OUlPfTQWDuWf8JSJeeZURhzbua5r8TWYmjjwXTDhWla4WR88RGlSkHxgOtcknldyWVq6o-AvyvTwGSvnLhbPAt0ux7PRoJV8-g2RmR5hc-7QCSNycuuIW1vmgixaU5u9ZVU2sgBx7XPEhW9nYOlQ08Y_GFl6tNS9mm9sa6Vq7ArRXXooU2ErhEslw58m5OAas7blV_E.Mi-m3PKb1c0PxCVJVpFa0xPmlzlUAYCyZcnCL0b97Xo%26dib_tag%3Dse%26keywords%3DElectr%25C3%25B3nicos%26qid%3D1725876194%26sr%3D8-17-spons%26sp_csd%3Dd2lkZ2V0TmFtZT1zcF9tdGY%26psc%3D1%26smid%3DA1NCW8Y125T2K9,"Bob and Brad Pistola de masaje X6 Pro Max con terapia de cabeza de calor, frío y metal, elegible para FSA/HSA, pistola masajeadora de tejido profundo de percusión para atletas, pistola eléctrica de",B0D14N8B5M,135.99,Sin información,400+ comprados el mes pasado,4.7,1636,https://m.media-amazon.com/images/I/612nRGcIP7L._AC_UY218_.jpg,400.0
https://www.amazon.com/-/es/etiquetadora-P21-etiquetadoras-inal%C3%A1mbricas-plantillas/dp/B0C3L93F2Q/ref=sr_1_18?dib=eyJ2IjoiMSJ9.ZvwoN-i8FFuSi3WgF40HuSZL8PLTBLGBQaE8OUlPfTQWDuWf8JSJeeZURhzbua5r8TWYmjjwXTDhWla4WR88RGlSkHxgOtcknldyWVq6o-AvyvTwGSvnLhbPAt0ux7PRoJV8-g2RmR5hc-7QCSNycuuIW1vmgixaU5u9ZVU2sgBx7XPEhW9nYOlQ08Y_GFl6tNS9mm9sa6Vq7ArRXXooU2ErhEslw58m5OAas7blV_E.Mi-m3PKb1c0PxCVJVpFa0xPmlzlUAYCyZcnCL0b97Xo&dib_tag=se&keywords=Electr%C3%B3nicos&qid=1725876194&sr=8-18,"Nelko Máquina etiquetadora con cinta, impresora de etiquetas Bluetooth P21, mini etiquetadoras inalámbricas con múltiples plantillas para organizar la oficina y el hogar, color blanco",B0C3L93F2Q,19.98,Sin información,20 K+ comprados el mes pasado,4.4,5227,https://m.media-amazon.com/images/I/618uNch+1pL._AC_UY218_.jpg,20000.0
https://www.amazon.com/-/es/sspa/click?ie=UTF8&spc=MTo1MjgwMzEyNDIxMjkxMDE6MTcyNTg3NjE5NDpzcF9idGY6MzAwNDAwOTE2MDYzOTAyOjowOjo&url=%2Fproyector-inteligente-integrado-Bluetooth-compatible%2Fdp%2FB0CRHFHCLC%2Fref%3Dsr_1_19_sspa%3Fdib%3DeyJ2IjoiMSJ9.ZvwoN-i8FFuSi3WgF40HuSZL8PLTBLGBQaE8OUlPfTQWDuWf8JSJeeZURhzbua5r8TWYmjjwXTDhWla4WR88RGlSkHxgOtcknldyWVq6o-AvyvTwGSvnLhbPAt0ux7PRoJV8-g2RmR5hc-7QCSNycuuIW1vmgixaU5u9ZVU2sgBx7XPEhW9nYOlQ08Y_GFl6tNS9mm9sa6Vq7ArRXXooU2ErhEslw58m5OAas7blV_E.Mi-m3PKb1c0PxCVJVpFa0xPmlzlUAYCyZcnCL0b97Xo%26dib_tag%3Dse%26keywords%3DElectr%25C3%25B3nicos%26qid%3D1725876194%26sr%3D8-19-spons%26sp_csd%3Dd2lkZ2V0TmFtZT1zcF9idGY%26psc%3D1,"Mini proyector, proyector inteligente Natvie 1080P Android TV 11.0 integrado, con Wifi y Bluetooth, Auto Keystone 4K compatible con 12000 lúmenes, proyector de tiro corto de rotación de 180",B0CRHFHCLC,99.99,Sin información,50+ comprados el mes pasado,4.0,164,https://m.media-amazon.com/images/I/815w0OufxBL._AC_UY218_.jpg,50.0
https://www.amazon.com/-/es/sspa/click?ie=UTF8&spc=MTo1MjgwMzEyNDIxMjkxMDE6MTcyNTg3NjE5NDpzcF9idGY6MzAwMjEzMDg3MjUzMTAyOjowOjo&url=%2FAuriculares-inal%25C3%25A1mbricos-cancelaci%25C3%25B3n-autoajustables-reproducci%25C3%25B3n%2Fdp%2FB0B1LVC5VZ%2Fref%3Dsr_1_20_sspa%3Fdib%3DeyJ2IjoiMSJ9.ZvwoN-i8FFuSi3WgF40HuSZL8PLTBLGBQaE8OUlPfTQWDuWf8JSJeeZURhzbua5r8TWYmjjwXTDhWla4WR88RGlSkHxgOtcknldyWVq6o-AvyvTwGSvnLhbPAt0ux7PRoJV8-g2RmR5hc-7QCSNycuuIW1vmgixaU5u9ZVU2sgBx7XPEhW9nYOlQ08Y_GFl6tNS9mm9sa6Vq7ArRXXooU2ErhEslw58m5OAas7blV_E.Mi-m3PKb1c0PxCVJVpFa0xPmlzlUAYCyZcnCL0b97Xo%26dib_tag%3Dse%26keywords%3DElectr%25C3%25B3nicos%26qid%3D1725876194%26sr%3D8-20-spons%26sp_csd%3Dd2lkZ2V0TmFtZT1zcF9idGY%26psc%3D1,"Soundcore by Anker Space A40 Auriculares inalámbricos con cancelación activa de ruido, reducen el ruido hasta un 98%, tiempo de reproducción ultra largo de 50 horas, tiempo de reproducción único de 10",B0B1LVC5VZ,47.99,Sin información,10 K+ comprados el mes pasado,4.2,13135,https://m.media-amazon.com/images/I/51EwBP9U2YL._AC_UY218_.jpg,10000.0
https://www.amazon.com/-/es/sspa/click?ie=UTF8&spc=MTo1MjgwMzEyNDIxMjkxMDE6MTcyNTg3NjE5NDpzcF9idGY6MzAwMjg5NDg1OTk2MzAyOjowOjo&url=%2FProyector-autom%25C3%25A1tico-interiores-exteriores-aplicaciones%2Fdp%2FB0CY5GCGT9%2Fref%3Dsr_1_21_sspa%3Fdib%3DeyJ2IjoiMSJ9.ZvwoN-i8FFuSi3WgF40HuSZL8PLTBLGBQaE8OUlPfTQWDuWf8JSJeeZURhzbua5r8TWYmjjwXTDhWla4WR88RGlSkHxgOtcknldyWVq6o-AvyvTwGSvnLhbPAt0ux7PRoJV8-g2RmR5hc-7QCSNycuuIW1vmgixaU5u9ZVU2sgBx7XPEhW9nYOlQ08Y_GFl6tNS9mm9sa6Vq7ArRXXooU2ErhEslw58m5OAas7blV_E.Mi-m3PKb1c0PxCVJVpFa0xPmlzlUAYCyZcnCL0b97Xo%26dib_tag%3Dse%26keywords%3DElectr%25C3%25B3nicos%26qid%3D1725876194%26sr%3D8-21-spons%26sp_csd%3Dd2lkZ2V0TmFtZT1zcF9idGY%26psc%3D1%26smid%3DATVWHKBHQR8G9,"Proyector de luz diurna de enfoque automático 4K, proyector de juegos de película Ultra HD, LED Smart WiFi, Bluetooth, proyector de cine en casa para interiores y exteriores, 4K HDR HDMI, aplicaciones",B0CY5GCGT9,495.0,Sin información,Sin información,4.2,14,https://m.media-amazon.com/images/I/71WXBOjgq9L._AC_UY218_.jpg,
https://www.amazon.com/-/es/sspa/click?ie=UTF8&spc=MTo1ODgxMTg0NjA3MTY0OTkxOjE3MjU4NzYyMTM6c3BfYXRmX25leHQ6MjAwMDk3NjkwNjI4Nzk4OjowOjo&url=%2Fremanufacturado-capacidad-Versalink-106R03584-rendimiento%2Fdp%2FB07G8PG9B1%2Fref%3Dsr_1_17_sspa%3Fdib%3DeyJ2IjoiMSJ9.5D-H1ycj2qj_vN1oNeCbtLc8sebgpihsw6vSmNH9BR-GbC4mXVjZndtV5dfcKDgZbburofSi2EgBvOl_MgRSIacviCjVIaS_RpuzVsu3xG02Jt5ZnLwrrfKjjzgAk3tr05mo5sKj9qRPRhANcUzl53WhtNH5UksEVVQyTNbr6EQjBUpz8apYs3Z4FAYBnD4Kew-9n1_E6-amlpKZJ2RGx44Ol7CN3G5VT_DNPCLJz6g.6kp3XyBJVeV6AXPdiF4k8NNfwWXt-sFEqus68ygXYVc%26dib_tag%3Dse%26keywords%3DElectr%25C3%25B3nicos%26qid%3D1725876213%26sr%3D8-17-spons%26sp_csd%3Dd2lkZ2V0TmFtZT1zcF9hdGZfbmV4dA%26psc%3D1,"Toner Pros [Cartucho de tóner remanufacturado de capacidad extra alta para Xerox Versalink 106R03584 (negro, rendimiento de páginas: 24,600 páginas) para impresoras Xerox Versalink B400,405DN",B07G8PG9B1,35.0,Sin información,Compra productos de marcas de pequeñas empresas que se venden en la plataforma Amazon. Descubre más sobre las pequeñas empresas que se asocian con Amazon y el compromiso de Amazon de empoderarlas.,5.0,1,https://m.media-amazon.com/images/I/51Fsy2ApMPL._AC_UY218_.jpg,
https://www.amazon.com/-/es/pulgadas-pantalla-altavoces-cu%C3%A1druples-m%C3%BAltiples/dp/B0CLF3VPMV/ref=sr_1_19?dib=eyJ2IjoiMSJ9.5D-H1ycj2qj_vN1oNeCbtLc8sebgpihsw6vSmNH9BR-GbC4mXVjZndtV5dfcKDgZbburofSi2EgBvOl_MgRSIacviCjVIaS_RpuzVsu3xG02Jt5ZnLwrrfKjjzgAk3tr05mo5sKj9qRPRhANcUzl53WhtNH5UksEVVQyTNbr6EQjBUpz8apYs3Z4FAYBnD4Kew-9n1_E6-amlpKZJ2RGx44Ol7CN3G5VT_DNPCLJz6g.6kp3XyBJVeV6AXPdiF4k8NNfwWXt-sFEqus68ygXYVc&dib_tag=se&keywords=Electr%C3%B3nicos&qid=1725876213&sr=8-19,"SAMSUNG Galaxy Tab A9+ Tablet Android de 11 pulgadas y 64 GB, pantalla grande, altavoces cuádruples, chipset mejorado, pantalla de múltiples ventanas, diseño delgado, ligero, duradero, versión",B0CLF3VPMV,197.99,Sin información,6 K+ comprados el mes pasado,4.5,5329,https://m.media-amazon.com/images/I/61d46oYQgdL._AC_UY218_.jpg,6000.0
https://www.amazon.com/-/es/inal%C3%A1mbricos-impermeable-reproducci%C3%B3n-emparejamiento-dispositivos/dp/B0BRKQDS3S/ref=sr_1_20?dib=eyJ2IjoiMSJ9.5D-H1ycj2qj_vN1oNeCbtLc8sebgpihsw6vSmNH9BR-GbC4mXVjZndtV5dfcKDgZbburofSi2EgBvOl_MgRSIacviCjVIaS_RpuzVsu3xG02Jt5ZnLwrrfKjjzgAk3tr05mo5sKj9qRPRhANcUzl53WhtNH5UksEVVQyTNbr6EQjBUpz8apYs3Z4FAYBnD4Kew-9n1_E6-amlpKZJ2RGx44Ol7CN3G5VT_DNPCLJz6g.6kp3XyBJVeV6AXPdiF4k8NNfwWXt-sFEqus68ygXYVc&dib_tag=se&keywords=Electr%C3%B3nicos&qid=1725876213&sr=8-20,"Altavoces inalámbricos portátiles Bluetooth con sonido HD, IPX5 impermeable, hasta 24 horas de reproducción, emparejamiento TWS, BT5.3, para el hogar, fiesta, al aire libre/playa, dispositivos",B0BRKQDS3S,29.99,Sin información,2 K+ comprados el mes pasado,4.5,13798,https://m.media-amazon.com/images/I/81DxScjnZkL._AC_UY218_.jpg,2000.0
https://www.amazon.com/-/es/pulgadas-incluido-duraci%C3%B3n-almacenamiento-ampliable/dp/B0CWS7W8Q1/ref=sr_1_21?dib=eyJ2IjoiMSJ9.5D-H1ycj2qj_vN1oNeCbtLc8sebgpihsw6vSmNH9BR-GbC4mXVjZndtV5dfcKDgZbburofSi2EgBvOl_MgRSIacviCjVIaS_RpuzVsu3xG02Jt5ZnLwrrfKjjzgAk3tr05mo5sKj9qRPRhANcUzl53WhtNH5UksEVVQyTNbr6EQjBUpz8apYs3Z4FAYBnD4Kew-9n1_E6-amlpKZJ2RGx44Ol7CN3G5VT_DNPCLJz6g.6kp3XyBJVeV6AXPdiF4k8NNfwWXt-sFEqus68ygXYVc&dib_tag=se&keywords=Electr%C3%B3nicos&qid=1725876213&sr=8-21,"SAMSUNG Galaxy Tab S6 Lite (2024) Tableta Android WiFi de 10.4 pulgadas, 64 GB, S Pen incluido, listo para jugar, batería de larga duración, diseño delgado de metal, almacenamiento ampliable, versión",B0CWS7W8Q1,272.0,Sin información,1 K+ comprados el mes pasado,4.5,615,https://m.media-amazon.com/images/I/61QfSvAihfL._AC_UY218_.jpg,1000.0
https://www.amazon.com/-/es/Regleta-protectora-sobretensiones-extensor-extensi%C3%B3n/dp/B092J8LPWR/ref=sr_1_22?dib=eyJ2IjoiMSJ9.5D-H1ycj2qj_vN1oNeCbtLc8sebgpihsw6vSmNH9BR-GbC4mXVjZndtV5dfcKDgZbburofSi2EgBvOl_MgRSIacviCjVIaS_RpuzVsu3xG02Jt5ZnLwrrfKjjzgAk3tr05mo5sKj9qRPRhANcUzl53WhtNH5UksEVVQyTNbr6EQjBUpz8apYs3Z4FAYBnD4Kew-9n1_E6-amlpKZJ2RGx44Ol7CN3G5VT_DNPCLJz6g.6kp3XyBJVeV6AXPdiF4k8NNfwWXt-sFEqus68ygXYVc&dib_tag=se&keywords=Electr%C3%B3nicos&qid=1725876213&sr=8-22,"Regleta protectora de sobretensiones – 8 salidas con 4 puertos de carga USB (2 USB C), extensor de salida múltiple, cable de extensión trenzado de 5 pies, enchufe plano, montaje en pared, estación de",B092J8LPWR,12.99,Sin información,10 K+ comprados el mes pasado,4.8,43207,https://m.media-amazon.com/images/I/61q9hmplGFL._AC_UY218_.jpg,10000.0
https://www.amazon.com/-/es/Soundcore-Anker-P20i-inal%C3%A1mbricos-controladores/dp/B0D5HSP346/ref=sr_1_23?dib=eyJ2IjoiMSJ9.5D-H1ycj2qj_vN1oNeCbtLc8sebgpihsw6vSmNH9BR-GbC4mXVjZndtV5dfcKDgZbburofSi2EgBvOl_MgRSIacviCjVIaS_RpuzVsu3xG02Jt5ZnLwrrfKjjzgAk3tr05mo5sKj9qRPRhANcUzl53WhtNH5UksEVVQyTNbr6EQjBUpz8apYs3Z4FAYBnD4Kew-9n1_E6-amlpKZJ2RGx44Ol7CN3G5VT_DNPCLJz6g.6kp3XyBJVeV6AXPdiF4k8NNfwWXt-sFEqus68ygXYVc&dib_tag=se&keywords=Electr%C3%B3nicos&qid=1725876213&sr=8-23,"Soundcore by Anker P20i - Audífonos inalámbricos verdaderos, controladores de 0.394 pulgadas con graves grandes, Bluetooth 5.3, 30 horas de tiempo de reproducción, resistentes al agua, 2 micrófonos",B0D5HSP346,39.99,Sin información,1 K+ comprados el mes pasado,4.4,31208,https://m.media-amazon.com/images/I/61aEVxrvxHL._AC_UY218_.jpg,1000.0
https://www.amazon.com/-/es/Bose-QuietComfort-Auriculares-inal%C3%A1mbricos-cancelaci%C3%B3n/dp/B0CCZC9J1V/ref=sr_1_24?dib=eyJ2IjoiMSJ9.5D-H1ycj2qj_vN1oNeCbtLc8sebgpihsw6vSmNH9BR-GbC4mXVjZndtV5dfcKDgZbburofSi2EgBvOl_MgRSIacviCjVIaS_RpuzVsu3xG02Jt5ZnLwrrfKjjzgAk3tr05mo5sKj9qRPRhANcUzl53WhtNH5UksEVVQyTNbr6EQjBUpz8apYs3Z4FAYBnD4Kew-9n1_E6-amlpKZJ2RGx44Ol7CN3G5VT_DNPCLJz6g.6kp3XyBJVeV6AXPdiF4k8NNfwWXt-sFEqus68ygXYVc&dib_tag=se&keywords=Electr%C3%B3nicos&qid=1725876213&sr=8-24,"Bose QuietComfort - Auriculares inalámbricos con cancelación de ruido, Bluetooth sobre la oreja con hasta 24 horas de duración de la batería, humo blanco",B0CCZC9J1V,349.0,Sin información,2 K+ comprados el mes pasado,4.6,4797,https://m.media-amazon.com/images/I/51K77J9rCjL._AC_UY218_.jpg,2000.0
https://www.amazon.com/-/es/Walkers-Razor-Slim-Orejeras-electr%C3%B3nicas/dp/B01AAH8CMA/ref=sr_1_25?dib=eyJ2IjoiMSJ9.5D-H1ycj2qj_vN1oNeCbtLc8sebgpihsw6vSmNH9BR-GbC4mXVjZndtV5dfcKDgZbburofSi2EgBvOl_MgRSIacviCjVIaS_RpuzVsu3xG02Jt5ZnLwrrfKjjzgAk3tr05mo5sKj9qRPRhANcUzl53WhtNH5UksEVVQyTNbr6EQjBUpz8apYs3Z4FAYBnD4Kew-9n1_E6-amlpKZJ2RGx44Ol7CN3G5VT_DNPCLJz6g.6kp3XyBJVeV6AXPdiF4k8NNfwWXt-sFEqus68ygXYVc&dib_tag=se&keywords=Electr%C3%B3nicos&qid=1725876213&sr=8-25,Walker's Orejeras,B01AAH8CMA,38.83,Sin información,4 K+ comprados el mes pasado,4.8,73294,https://m.media-amazon.com/images/I/61vpMEEn3qL._AC_UY218_.jpg,4000.0
https://www.amazon.com/-/es/SAMSUNG-velocidades-secuenciales-estaciones-computaci%C3%B3n/dp/B0CHGT1KFJ/ref=sr_1_26?dib=eyJ2IjoiMSJ9.5D-H1ycj2qj_vN1oNeCbtLc8sebgpihsw6vSmNH9BR-GbC4mXVjZndtV5dfcKDgZbburofSi2EgBvOl_MgRSIacviCjVIaS_RpuzVsu3xG02Jt5ZnLwrrfKjjzgAk3tr05mo5sKj9qRPRhANcUzl53WhtNH5UksEVVQyTNbr6EQjBUpz8apYs3Z4FAYBnD4Kew-9n1_E6-amlpKZJ2RGx44Ol7CN3G5VT_DNPCLJz6g.6kp3XyBJVeV6AXPdiF4k8NNfwWXt-sFEqus68ygXYVc&dib_tag=se&keywords=Electr%C3%B3nicos&qid=1725876213&sr=8-26,"SAMSUNG 990 PRO SSD 4TB PCIe 4.0 M.2 2280 Disco duro interno de estado sólido, velocidades de lectura secuenciales de hasta 7,450 MB/s para estaciones de trabajo de alta gama, computación y juegos,",B0CHGT1KFJ,319.99,Sin información,4 K+ comprados el mes pasado,4.8,8925,https://m.media-amazon.com/images/I/81WuG6lQuDL._AC_UY218_.jpg,4000.0
