link_producto,producto,asin,precio,precio_original,vendidos_mes_pasado,calificación,num_de_calificaciones,imagen,vendidos_numerico
https://www.amazon.com/-/es/sspa/click?ie=UTF8&spc=MTo1MTcxMzQwMTQ4NTM2ODg0OjE3MjU4NzY1NDI6c3BfYXRmX25leHQ6MjAwMTUwNDY0NTY0Mzk4OjowOjo&url=%2FPurificadores-habitaciones-cuadrados-inteligente-HEPASilent%2Fdp%2FB0BN2MGV5H%2Fref%3Dsr_1_145_sspa%3Fdib%3DeyJ2IjoiMSJ9.eIPR2hwBueZUegf5weN3JYWlZ3IZ8IL3_NpfECweoTkJoF1jNDLqZx8PTrxL0V5Zk8FU3P8q9tvPEkFJ4eMjvhWj5n8MIb7NXGSknWnU2hntj3Ob0rQxi-Z85sWmc7q5aKISTxh5iT78bvbWr1V5ASIv-QiKgmCzfTQp4L3DWaFKn7w1w5Ix8-PMZOgtNim5iDUxHZLmb9-UZE4qE_Lee6_yZxE5Rs-x2kPCBb1JEAa4SGuGiBCn85EwCooNeugEBXNsA4fCe43XoAxE8lnZaszLhOJDqJWHJx1JgMbHnKw.oxmfJ6UBfJYHGGVF3NIVBRegu3UlCv5Mgr6oEJH592A%26dib_tag%3Dse%26keywords%3DHogar%2By%2Bcocina%26qid%3D1725876542%26sr%3D8-145-spons%26sp_csd%3Dd2lkZ2V0TmFtZT1zcF9hdGZfbmV4dA%26psc%3D1,"BLUEAIR Purificadores de aire para habitaciones grandes, limpia 3,048 pies cuadrados en una hora, limpiador de aire inteligente HEPASilent para el hogar, mascotas, alergias, virus, polvo, moho, humo,",B0BN2MGV5H,244.99,Sin información,4 K+ comprados el mes pasado,4.5,10537,https://m.media-amazon.com/images/I/81-DBzXUBwL._AC_UL320_.jpg,4000.0
https://www.amazon.com/-/es/sspa/click?ie=UTF8&spc=MTo1MTcxMzQwMTQ4NTM2ODg0OjE3MjU4NzY1NDI6c3BfYXRmX25leHQ6MzAwMDI4Njc5MDIyMTAyOjowOjo&url=%2Fextintor-incendios-superficie-Capacidad-Extintor%2Fdp%2FB0949K8VP8%2Fref%3Dsr_1_146_sspa%3Fdib%3DeyJ2IjoiMSJ9.eIPR2hwBueZUegf5weN3JYWlZ3IZ8IL3_NpfECweoTkJoF1jNDLqZx8PTrxL0V5Zk8FU3P8q9tvPEkFJ4eMjvhWj5n8MIb7NXGSknWnU2hntj3Ob0rQxi-Z85sWmc7q5aKISTxh5iT78bvbWr1V5ASIv-QiKgmCzfTQp4L3DWaFKn7w1w5Ix8-PMZOgtNim5iDUxHZLmb9-UZE4qE_Lee6_yZxE5Rs-x2kPCBb1JEAa4SGuGiBCn85EwCooNeugEBXNsA4fCe43XoAxE8lnZaszLhOJDqJWHJx1JgMbHnKw.oxmfJ6UBfJYHGGVF3NIVBRegu3UlCv5Mgr6oEJH592A%26dib_tag%3Dse%26keywords%3DHogar%2By%2Bcocina%26qid%3D1725876542%26sr%3D8-146-spons%26sp_csd%3Dd2lkZ2V0TmFtZT1zcF9hdGZfbmV4dA%26psc%3D1,"Armario extintor de incendios | Armario de acero para montaje en pared y superficie | Capacidad para 5 libras y 10 libras | Sin puerta con versión de vidrio roto, rojo | Extintor de incendios no incluido",B0949K8VP8,145.0,Sin información,Compra productos de marcas de pequeñas empresas que se venden en la plataforma Amazon. Descubre más sobre las pequeñas empresas que se asocian con Amazon y el compromiso de Amazon de empoderarlas.,4.5,22,https://m.media-amazon.com/images/I/51jbSSlEi7S._AC_UL320_.jpg,
https://www.amazon.com/-/es/sspa/click?ie=UTF8&spc=MTo1MTcxMzQwMTQ4NTM2ODg0OjE3MjU4NzY1NDI6c3BfYXRmX25leHQ6MjAwMDk0Njg2ODgwMDk4OjowOjo&url=%2FNextmug-autocalentable-control-temperatura-negro%2Fdp%2FB0B6JTX6NB%2Fref%3Dsr_1_147_sspa%3Fdib%3DeyJ2IjoiMSJ9.eIPR2hwBueZUegf5weN3JYWlZ3IZ8IL3_NpfECweoTkJoF1jNDLqZx8PTrxL0V5Zk8FU3P8q9tvPEkFJ4eMjvhWj5n8MIb7NXGSknWnU2hntj3Ob0rQxi-Z85sWmc7q5aKISTxh5iT78bvbWr1V5ASIv-QiKgmCzfTQp4L3DWaFKn7w1w5Ix8-PMZOgtNim5iDUxHZLmb9-UZE4qE_Lee6_yZxE5Rs-x2kPCBb1JEAa4SGuGiBCn85EwCooNeugEBXNsA4fCe43XoAxE8lnZaszLhOJDqJWHJx1JgMbHnKw.oxmfJ6UBfJYHGGVF3NIVBRegu3UlCv5Mgr6oEJH592A%26dib_tag%3Dse%26keywords%3DHogar%2By%2Bcocina%26qid%3D1725876542%26sr%3D8-147-spons%26sp_csd%3Dd2lkZ2V0TmFtZT1zcF9hdGZfbmV4dA%26psc%3D1,"Nextmug - Taza de café autocalentable con control de temperatura (negro, 14 onzas)",B0B6JTX6NB,99.95,Sin información,900+ comprados el mes pasado,4.3,3216,https://m.media-amazon.com/images/I/71D51fALypL._AC_UL320_.jpg,900.0
https://www.amazon.com/-/es/sspa/click?ie=UTF8&spc=MTo1MTcxMzQwMTQ4NTM2ODg0OjE3MjU4NzY1NDI6c3BfYXRmX25leHQ6MjAwMTcyMTUzMDgzMDk4OjowOjo&url=%2FTrapp-Fragancia-arom%25C3%25A1tica-acuosas-florales%2Fdp%2FB09KT64V4C%2Fref%3Dsr_1_148_sspa%3Fdib%3DeyJ2IjoiMSJ9.eIPR2hwBueZUegf5weN3JYWlZ3IZ8IL3_NpfECweoTkJoF1jNDLqZx8PTrxL0V5Zk8FU3P8q9tvPEkFJ4eMjvhWj5n8MIb7NXGSknWnU2hntj3Ob0rQxi-Z85sWmc7q5aKISTxh5iT78bvbWr1V5ASIv-QiKgmCzfTQp4L3DWaFKn7w1w5Ix8-PMZOgtNim5iDUxHZLmb9-UZE4qE_Lee6_yZxE5Rs-x2kPCBb1JEAa4SGuGiBCn85EwCooNeugEBXNsA4fCe43XoAxE8lnZaszLhOJDqJWHJx1JgMbHnKw.oxmfJ6UBfJYHGGVF3NIVBRegu3UlCv5Mgr6oEJH592A%26dib_tag%3Dse%26keywords%3DHogar%2By%2Bcocina%26qid%3D1725876542%26sr%3D8-148-spons%26sp_csd%3Dd2lkZ2V0TmFtZT1zcF9hdGZfbmV4dA%26psc%3D1,"Trapp - Agua No. 20 - Vela de 3 mechas de 16 onzas - Fragancia aromática para el hogar con aroma fresco de ozono fresco, notas acuosas y notas florales blancas - Mezcla de cera de soja",B09KT64V4C,48.0,Sin información,"(
US$3.00
US$3.00/Ounce)",3.7,4,https://m.media-amazon.com/images/I/617f2zXiMrL._AC_UL320_.jpg,
https://www.amazon.com/-/es/Spice-rack-over-the-door/dp/B0D723NJWF/ref=sr_1_149?dib=eyJ2IjoiMSJ9.eIPR2hwBueZUegf5weN3JYWlZ3IZ8IL3_NpfECweoTkJoF1jNDLqZx8PTrxL0V5Zk8FU3P8q9tvPEkFJ4eMjvhWj5n8MIb7NXGSknWnU2hntj3Ob0rQxi-Z85sWmc7q5aKISTxh5iT78bvbWr1V5ASIv-QiKgmCzfTQp4L3DWaFKn7w1w5Ix8-PMZOgtNim5iDUxHZLmb9-UZE4qE_Lee6_yZxE5Rs-x2kPCBb1JEAa4SGuGiBCn85EwCooNeugEBXNsA4fCe43XoAxE8lnZaszLhOJDqJWHJx1JgMbHnKw.oxmfJ6UBfJYHGGVF3NIVBRegu3UlCv5Mgr6oEJH592A&dib_tag=se&keywords=Hogar+y+cocina&qid=1725876542&sr=8-149,"Moforoco 9-Tier Over The Door Pantry Organizer, Pantry Organization and Storage, Black Hanging Basket Wall Spice Rack Seasoning Shelves, Home & Kitchen",B0D723NJWF,44.99,Sin información,100+ comprados el mes pasado,4.3,126,https://m.media-amazon.com/images/I/91LgOgiobIL._AC_UL320_.jpg,100.0
https://www.amazon.com/-/es/emergencia-incendios-ign%C3%ADfuga-seguridad-protecci%C3%B3n/dp/B0CWS9CWZM/ref=sr_1_150?dib=eyJ2IjoiMSJ9.eIPR2hwBueZUegf5weN3JYWlZ3IZ8IL3_NpfECweoTkJoF1jNDLqZx8PTrxL0V5Zk8FU3P8q9tvPEkFJ4eMjvhWj5n8MIb7NXGSknWnU2hntj3Ob0rQxi-Z85sWmc7q5aKISTxh5iT78bvbWr1V5ASIv-QiKgmCzfTQp4L3DWaFKn7w1w5Ix8-PMZOgtNim5iDUxHZLmb9-UZE4qE_Lee6_yZxE5Rs-x2kPCBb1JEAa4SGuGiBCn85EwCooNeugEBXNsA4fCe43XoAxE8lnZaszLhOJDqJWHJx1JgMbHnKw.oxmfJ6UBfJYHGGVF3NIVBRegu3UlCv5Mgr6oEJH592A&dib_tag=se&keywords=Hogar+y+cocina&qid=1725876542&sr=8-150,"Manta de emergencia contra incendios, 1 paquete, manta de fibra de vidrio ignífuga de 40 x 40 pulgadas para seguridad en el hogar, protección rápida y segura para tu hogar y cocina",B0CWS9CWZM,18.99,Sin información,2 K+ comprados el mes pasado,4.9,65,https://m.media-amazon.com/images/I/81YtKSCCWpL._AC_UL320_.jpg,2000.0
https://www.amazon.com/-/es/01/dp/B0D9HRPJC1/ref=sr_1_151?dib=eyJ2IjoiMSJ9.eIPR2hwBueZUegf5weN3JYWlZ3IZ8IL3_NpfECweoTkJoF1jNDLqZx8PTrxL0V5Zk8FU3P8q9tvPEkFJ4eMjvhWj5n8MIb7NXGSknWnU2hntj3Ob0rQxi-Z85sWmc7q5aKISTxh5iT78bvbWr1V5ASIv-QiKgmCzfTQp4L3DWaFKn7w1w5Ix8-PMZOgtNim5iDUxHZLmb9-UZE4qE_Lee6_yZxE5Rs-x2kPCBb1JEAa4SGuGiBCn85EwCooNeugEBXNsA4fCe43XoAxE8lnZaszLhOJDqJWHJx1JgMbHnKw.oxmfJ6UBfJYHGGVF3NIVBRegu3UlCv5Mgr6oEJH592A&dib_tag=se&keywords=Hogar+y+cocina&qid=1725876542&sr=8-151,"Titanium Cutting Board - 100% Pure Titanium Cutting Boards for Kitche, Upgrade Double Sided Food-Grade Titanium Board, Thick Titanium Cutting Board for Home Kitchen Cooking (14 * 10in) (14x10in)",B0D9HRPJC1,15.89,Sin información,100+ comprados el mes pasado,3.2,16,https://m.media-amazon.com/images/I/5153XMMGIAL._AC_UL320_.jpg,100.0
https://www.amazon.com/-/es/Pauwer-tapetes-antideslizantes-acolchados-impermeable/dp/B0D7PW64DS/ref=sr_1_152?dib=eyJ2IjoiMSJ9.eIPR2hwBueZUegf5weN3JYWlZ3IZ8IL3_NpfECweoTkJoF1jNDLqZx8PTrxL0V5Zk8FU3P8q9tvPEkFJ4eMjvhWj5n8MIb7NXGSknWnU2hntj3Ob0rQxi-Z85sWmc7q5aKISTxh5iT78bvbWr1V5ASIv-QiKgmCzfTQp4L3DWaFKn7w1w5Ix8-PMZOgtNim5iDUxHZLmb9-UZE4qE_Lee6_yZxE5Rs-x2kPCBb1JEAa4SGuGiBCn85EwCooNeugEBXNsA4fCe43XoAxE8lnZaszLhOJDqJWHJx1JgMbHnKw.oxmfJ6UBfJYHGGVF3NIVBRegu3UlCv5Mgr6oEJH592A&dib_tag=se&keywords=Hogar+y+cocina&qid=1725876542&sr=8-152,"Pauwer Juego de 2 tapetes de cocina antideslizantes para piso, tapetes de cocina acolchados para piso, tapete cómodo de pie, tapete de pie impermeable de espuma de PVC para casa de campo",B0D7PW64DS,29.99,Sin información,50+ comprados el mes pasado,4.4,575,https://m.media-amazon.com/images/I/81D3U0rcBhL._AC_UL320_.jpg,50.0
https://www.amazon.com/-/es/Organizador-gabinete-extra%C3%ADble-deslizante-almacenamiento/dp/B0D5M5Z39Q/ref=sr_1_153?dib=eyJ2IjoiMSJ9.eIPR2hwBueZUegf5weN3JYWlZ3IZ8IL3_NpfECweoTkJoF1jNDLqZx8PTrxL0V5Zk8FU3P8q9tvPEkFJ4eMjvhWj5n8MIb7NXGSknWnU2hntj3Ob0rQxi-Z85sWmc7q5aKISTxh5iT78bvbWr1V5ASIv-QiKgmCzfTQp4L3DWaFKn7w1w5Ix8-PMZOgtNim5iDUxHZLmb9-UZE4qE_Lee6_yZxE5Rs-x2kPCBb1JEAa4SGuGiBCn85EwCooNeugEBXNsA4fCe43XoAxE8lnZaszLhOJDqJWHJx1JgMbHnKw.oxmfJ6UBfJYHGGVF3NIVBRegu3UlCv5Mgr6oEJH592A&dib_tag=se&keywords=Hogar+y+cocina&qid=1725876542&sr=8-153,"Organizador de gabinete extraíble, cajón deslizante de ABS para estante de especias, adhesivo sin taladro, estante deslizante para almacenamiento dentro del hogar, cocina, despensa, baño, armario,",B0D5M5Z39Q,14.99,Sin información,50+ comprados el mes pasado,5.0,1,https://m.media-amazon.com/images/I/81jVhK7dk0L._AC_UL320_.jpg,50.0
https://www.amazon.com/-/es/ComfiLife-antifatiga-pulgadas-resistente-antideslizante/dp/B07S8M5SQC/ref=sr_1_154?dib=eyJ2IjoiMSJ9.eIPR2hwBueZUegf5weN3JYWlZ3IZ8IL3_NpfECweoTkJoF1jNDLqZx8PTrxL0V5Zk8FU3P8q9tvPEkFJ4eMjvhWj5n8MIb7NXGSknWnU2hntj3Ob0rQxi-Z85sWmc7q5aKISTxh5iT78bvbWr1V5ASIv-QiKgmCzfTQp4L3DWaFKn7w1w5Ix8-PMZOgtNim5iDUxHZLmb9-UZE4qE_Lee6_yZxE5Rs-x2kPCBb1JEAa4SGuGiBCn85EwCooNeugEBXNsA4fCe43XoAxE8lnZaszLhOJDqJWHJx1JgMbHnKw.oxmfJ6UBfJYHGGVF3NIVBRegu3UlCv5Mgr6oEJH592A&dib_tag=se&keywords=Hogar+y+cocina&qid=1725876542&sr=8-154,"ComfiLife - Tapete antifatiga de 0.75 pulgadas de grosor, perfecto para la cocina, la oficina o el garaje - Duradera y resistente a las manchas - Parte inferior antideslizante",B07S8M5SQC,39.96,Sin información,400+ comprados el mes pasado,4.7,38152,https://m.media-amazon.com/images/I/81I8xbr6xqL._AC_UL320_.jpg,400.0
https://www.amazon.com/-/es/Toallas-cocina-canela-%C3%B3xido-granate/dp/B0D8BXVXW8/ref=sr_1_155?dib=eyJ2IjoiMSJ9.eIPR2hwBueZUegf5weN3JYWlZ3IZ8IL3_NpfECweoTkJoF1jNDLqZx8PTrxL0V5Zk8FU3P8q9tvPEkFJ4eMjvhWj5n8MIb7NXGSknWnU2hntj3Ob0rQxi-Z85sWmc7q5aKISTxh5iT78bvbWr1V5ASIv-QiKgmCzfTQp4L3DWaFKn7w1w5Ix8-PMZOgtNim5iDUxHZLmb9-UZE4qE_Lee6_yZxE5Rs-x2kPCBb1JEAa4SGuGiBCn85EwCooNeugEBXNsA4fCe43XoAxE8lnZaszLhOJDqJWHJx1JgMbHnKw.oxmfJ6UBfJYHGGVF3NIVBRegu3UlCv5Mgr6oEJH592A&dib_tag=se&keywords=Hogar+y+cocina&qid=1725876542&sr=8-155,"Toallas de mano de cocina de canela y óxido granate: de gran tamaño, 28 x 18 pulgadas, paño 100% algodón, limpieza suave, secado absorbente, diseño texturizado, juego de 3 multiusos para uso diario",B0D8BXVXW8,14.99,Sin información,100+ comprados el mes pasado,4.5,638,https://m.media-amazon.com/images/I/817nYfDmNjL._AC_UL320_.jpg,100.0
https://www.amazon.com/-/es/Organizador-organizadores-almacenamiento-extra%C3%ADbles-deslizante/dp/B0CYSH1B8Z/ref=sr_1_156?dib=eyJ2IjoiMSJ9.eIPR2hwBueZUegf5weN3JYWlZ3IZ8IL3_NpfECweoTkJoF1jNDLqZx8PTrxL0V5Zk8FU3P8q9tvPEkFJ4eMjvhWj5n8MIb7NXGSknWnU2hntj3Ob0rQxi-Z85sWmc7q5aKISTxh5iT78bvbWr1V5ASIv-QiKgmCzfTQp4L3DWaFKn7w1w5Ix8-PMZOgtNim5iDUxHZLmb9-UZE4qE_Lee6_yZxE5Rs-x2kPCBb1JEAa4SGuGiBCn85EwCooNeugEBXNsA4fCe43XoAxE8lnZaszLhOJDqJWHJx1JgMbHnKw.oxmfJ6UBfJYHGGVF3NIVBRegu3UlCv5Mgr6oEJH592A&dib_tag=se&keywords=Hogar+y+cocina&qid=1725876542&sr=8-156,"Organizador en forma de L para debajo del fregadero, 2 unidades, organizadores y almacenamiento extraíbles de dos niveles, estante deslizante para fregadero, estantes de almacenamiento, estante",B0CYSH1B8Z,41.99,Sin información,200+ comprados el mes pasado,4.6,17,https://m.media-amazon.com/images/I/7121nvsZOYL._AC_UL320_.jpg,200.0
https://www.amazon.com/-/es/ARKENY-AD116-calabaza-pulgadas-decoraci%C3%B3n/dp/B0CD1K58B7/ref=sr_1_157?dib=eyJ2IjoiMSJ9.eIPR2hwBueZUegf5weN3JYWlZ3IZ8IL3_NpfECweoTkJoF1jNDLqZx8PTrxL0V5Zk8FU3P8q9tvPEkFJ4eMjvhWj5n8MIb7NXGSknWnU2hntj3Ob0rQxi-Z85sWmc7q5aKISTxh5iT78bvbWr1V5ASIv-QiKgmCzfTQp4L3DWaFKn7w1w5Ix8-PMZOgtNim5iDUxHZLmb9-UZE4qE_Lee6_yZxE5Rs-x2kPCBb1JEAa4SGuGiBCn85EwCooNeugEBXNsA4fCe43XoAxE8lnZaszLhOJDqJWHJx1JgMbHnKw.oxmfJ6UBfJYHGGVF3NIVBRegu3UlCv5Mgr6oEJH592A&dib_tag=se&keywords=Hogar+y+cocina&qid=1725876542&sr=8-157,"ARKENY AD116 - Juego de 2 paños de cocina de otoño, color naranja, calabaza, arce, otoño, 18 x 26 pulgadas, decoración del hogar de granja",B0CD1K58B7,13.99,Sin información,500+ comprados el mes pasado,4.1,12,https://m.media-amazon.com/images/I/61dtTxjcPXL._AC_UL320_.jpg,500.0
https://www.amazon.com/-/es/Temporizador-temporizador-magn%C3%A9tico-regresiva-alimentado/dp/B0CSDK59P5/ref=sr_1_158?dib=eyJ2IjoiMSJ9.eIPR2hwBueZUegf5weN3JYWlZ3IZ8IL3_NpfECweoTkJoF1jNDLqZx8PTrxL0V5Zk8FU3P8q9tvPEkFJ4eMjvhWj5n8MIb7NXGSknWnU2hntj3Ob0rQxi-Z85sWmc7q5aKISTxh5iT78bvbWr1V5ASIv-QiKgmCzfTQp4L3DWaFKn7w1w5Ix8-PMZOgtNim5iDUxHZLmb9-UZE4qE_Lee6_yZxE5Rs-x2kPCBb1JEAa4SGuGiBCn85EwCooNeugEBXNsA4fCe43XoAxE8lnZaszLhOJDqJWHJx1JgMbHnKw.oxmfJ6UBfJYHGGVF3NIVBRegu3UlCv5Mgr6oEJH592A&dib_tag=se&keywords=Hogar+y+cocina&qid=1725876542&sr=8-158,"VOCOO Temporizador digital de cocina con pantalla extra grande de 7.8 pulgadas, temporizador LED magnético con 3 brillo, 4 alarmas y 3 niveles de volumen, temporizador de cuenta regresiva alimentado",B0CSDK59P5,29.99,Sin información,500+ comprados el mes pasado,4.6,822,https://m.media-amazon.com/images/I/5102i-aGitL._AC_UL320_.jpg,500.0
https://www.amazon.com/-/es/eucalipto-calabaza-decoraci%C3%B3n-alfombras-pulgadas/dp/B0D228BL73/ref=sr_1_159?dib=eyJ2IjoiMSJ9.eIPR2hwBueZUegf5weN3JYWlZ3IZ8IL3_NpfECweoTkJoF1jNDLqZx8PTrxL0V5Zk8FU3P8q9tvPEkFJ4eMjvhWj5n8MIb7NXGSknWnU2hntj3Ob0rQxi-Z85sWmc7q5aKISTxh5iT78bvbWr1V5ASIv-QiKgmCzfTQp4L3DWaFKn7w1w5Ix8-PMZOgtNim5iDUxHZLmb9-UZE4qE_Lee6_yZxE5Rs-x2kPCBb1JEAa4SGuGiBCn85EwCooNeugEBXNsA4fCe43XoAxE8lnZaszLhOJDqJWHJx1JgMbHnKw.oxmfJ6UBfJYHGGVF3NIVBRegu3UlCv5Mgr6oEJH592A&dib_tag=se&keywords=Hogar+y+cocina&qid=1725876542&sr=8-159,"Artoid Mode Juego de 2 tapetes de cocina de eucalipto de calabaza naranja, decoración otoñal del hogar, alfombras de cocina de bajo perfil para piso, 17 x 29 y 17 x 47 pulgadas",B0D228BL73,29.99,Sin información,200+ comprados el mes pasado,4.7,51,https://m.media-amazon.com/images/I/719U5DjemTL._AC_UL320_.jpg,200.0
https://www.amazon.com/-/es/Organizador-extra%C3%ADble-deslizantes-resistentes-deslizante/dp/B0C9WKGQRZ/ref=sr_1_160?dib=eyJ2IjoiMSJ9.eIPR2hwBueZUegf5weN3JYWlZ3IZ8IL3_NpfECweoTkJoF1jNDLqZx8PTrxL0V5Zk8FU3P8q9tvPEkFJ4eMjvhWj5n8MIb7NXGSknWnU2hntj3Ob0rQxi-Z85sWmc7q5aKISTxh5iT78bvbWr1V5ASIv-QiKgmCzfTQp4L3DWaFKn7w1w5Ix8-PMZOgtNim5iDUxHZLmb9-UZE4qE_Lee6_yZxE5Rs-x2kPCBb1JEAa4SGuGiBCn85EwCooNeugEBXNsA4fCe43XoAxE8lnZaszLhOJDqJWHJx1JgMbHnKw.oxmfJ6UBfJYHGGVF3NIVBRegu3UlCv5Mgr6oEJH592A&dib_tag=se&keywords=Hogar+y+cocina&qid=1725876542&sr=8-160,"Organizador de gabinete extraíble fijo con nano película adhesiva, estantes de despensa deslizantes resistentes, cesta de malla deslizante con asa para cocina, baño, hogar, 9.8 pulgadas de ancho x",B0C9WKGQRZ,35.99,Sin información,50+ comprados el mes pasado,4.6,259,https://m.media-amazon.com/images/I/81+zEp-NoqL._AC_UL320_.jpg,50.0
https://www.amazon.com/-/es/ARKENY-AD334-decoraci%C3%B3n-calabaza-pulgadas/dp/B0CX8JJWPS/ref=sr_1_161?dib=eyJ2IjoiMSJ9.eIPR2hwBueZUegf5weN3JYWlZ3IZ8IL3_NpfECweoTkJoF1jNDLqZx8PTrxL0V5Zk8FU3P8q9tvPEkFJ4eMjvhWj5n8MIb7NXGSknWnU2hntj3Ob0rQxi-Z85sWmc7q5aKISTxh5iT78bvbWr1V5ASIv-QiKgmCzfTQp4L3DWaFKn7w1w5Ix8-PMZOgtNim5iDUxHZLmb9-UZE4qE_Lee6_yZxE5Rs-x2kPCBb1JEAa4SGuGiBCn85EwCooNeugEBXNsA4fCe43XoAxE8lnZaszLhOJDqJWHJx1JgMbHnKw.oxmfJ6UBfJYHGGVF3NIVBRegu3UlCv5Mgr6oEJH592A&dib_tag=se&keywords=Hogar+y+cocina&qid=1725876542&sr=8-161,"ARKENY AD334 - Juego de 2 paños de cocina de otoño para decoración de otoño, diseño de calabaza naranja a lunares, 18 x 26 pulgadas, decoración vintage de cosecha de Acción de Gracias",B0CX8JJWPS,13.99,Sin información,500+ comprados el mes pasado,4.3,69,https://m.media-amazon.com/images/I/61IIrdikWML._AC_UL320_.jpg,500.0
https://www.amazon.com/-/es/Soporte-organizador-fregadero-accesorios-antideslizante/dp/B0D16RL6MK/ref=sr_1_162?dib=eyJ2IjoiMSJ9.eIPR2hwBueZUegf5weN3JYWlZ3IZ8IL3_NpfECweoTkJoF1jNDLqZx8PTrxL0V5Zk8FU3P8q9tvPEkFJ4eMjvhWj5n8MIb7NXGSknWnU2hntj3Ob0rQxi-Z85sWmc7q5aKISTxh5iT78bvbWr1V5ASIv-QiKgmCzfTQp4L3DWaFKn7w1w5Ix8-PMZOgtNim5iDUxHZLmb9-UZE4qE_Lee6_yZxE5Rs-x2kPCBb1JEAa4SGuGiBCn85EwCooNeugEBXNsA4fCe43XoAxE8lnZaszLhOJDqJWHJx1JgMbHnKw.oxmfJ6UBfJYHGGVF3NIVBRegu3UlCv5Mgr6oEJH592A&dib_tag=se&keywords=Hogar+y+cocina&qid=1725876542&sr=8-162,"Cisily Soporte de esponja para cocina, organizador de fregadero, accesorios de fregadero de cocina con bandeja de goteo, soporte de esponja para fregadero de cocina a prueba de óxido y antideslizante,",B0D16RL6MK,16.99,Sin información,100+ comprados el mes pasado,5.0,1,https://m.media-amazon.com/images/I/81TdAT3qdML._AC_UL320_.jpg,100.0
https://www.amazon.com/-/es/toallas-surtidas-pulgadas-absorbentes-perfectas/dp/B08B6GKYXK/ref=sr_1_163?dib=eyJ2IjoiMSJ9.eIPR2hwBueZUegf5weN3JYWlZ3IZ8IL3_NpfECweoTkJoF1jNDLqZx8PTrxL0V5Zk8FU3P8q9tvPEkFJ4eMjvhWj5n8MIb7NXGSknWnU2hntj3Ob0rQxi-Z85sWmc7q5aKISTxh5iT78bvbWr1V5ASIv-QiKgmCzfTQp4L3DWaFKn7w1w5Ix8-PMZOgtNim5iDUxHZLmb9-UZE4qE_Lee6_yZxE5Rs-x2kPCBb1JEAa4SGuGiBCn85EwCooNeugEBXNsA4fCe43XoAxE8lnZaszLhOJDqJWHJx1JgMbHnKw.oxmfJ6UBfJYHGGVF3NIVBRegu3UlCv5Mgr6oEJH592A&dib_tag=se&keywords=Hogar+y+cocina&qid=1725876542&sr=8-163,"KAF Home Juego de 10 toallas de cocina planas surtidas, 100% algodón, 18 x 28 pulgadas, ultra absorbentes, suaves, perfectas para cocinar, limpiar y secar las manos (gris)",B08B6GKYXK,22.99,Sin información,200+ comprados el mes pasado,4.6,497,https://m.media-amazon.com/images/I/918xtEWitAL._AC_UL320_.jpg,200.0
https://www.amazon.com/-/es/Picadora-el%C3%A9ctrica-salchichas-molinillo-alimentos/dp/B0CFXXGRLX/ref=sr_1_164?dib=eyJ2IjoiMSJ9.eIPR2hwBueZUegf5weN3JYWlZ3IZ8IL3_NpfECweoTkJoF1jNDLqZx8PTrxL0V5Zk8FU3P8q9tvPEkFJ4eMjvhWj5n8MIb7NXGSknWnU2hntj3Ob0rQxi-Z85sWmc7q5aKISTxh5iT78bvbWr1V5ASIv-QiKgmCzfTQp4L3DWaFKn7w1w5Ix8-PMZOgtNim5iDUxHZLmb9-UZE4qE_Lee6_yZxE5Rs-x2kPCBb1JEAa4SGuGiBCn85EwCooNeugEBXNsA4fCe43XoAxE8lnZaszLhOJDqJWHJx1JgMbHnKw.oxmfJ6UBfJYHGGVF3NIVBRegu3UlCv5Mgr6oEJH592A&dib_tag=se&keywords=Hogar+y+cocina&qid=1725876542&sr=8-164,"Picadora eléctrica de carne, máquina de relleno de salchichas de 450 W (3000 W máximo), molinillo de alimentos con hoja y 3 platos, tubos de relleno de salchichas y kit de kubbe, máquina de picar",B0CFXXGRLX,69.99,Sin información,800+ comprados el mes pasado,4.3,386,https://m.media-amazon.com/images/I/712sEYgWdmL._AC_UL320_.jpg,800.0
https://www.amazon.com/-/es/Artoid-tapetes-decoraci%C3%B3n-alfombras-pulgadas/dp/B0D1XP7N2J/ref=sr_1_165?dib=eyJ2IjoiMSJ9.eIPR2hwBueZUegf5weN3JYWlZ3IZ8IL3_NpfECweoTkJoF1jNDLqZx8PTrxL0V5Zk8FU3P8q9tvPEkFJ4eMjvhWj5n8MIb7NXGSknWnU2hntj3Ob0rQxi-Z85sWmc7q5aKISTxh5iT78bvbWr1V5ASIv-QiKgmCzfTQp4L3DWaFKn7w1w5Ix8-PMZOgtNim5iDUxHZLmb9-UZE4qE_Lee6_yZxE5Rs-x2kPCBb1JEAa4SGuGiBCn85EwCooNeugEBXNsA4fCe43XoAxE8lnZaszLhOJDqJWHJx1JgMbHnKw.oxmfJ6UBfJYHGGVF3NIVBRegu3UlCv5Mgr6oEJH592A&dib_tag=se&keywords=Hogar+y+cocina&qid=1725876542&sr=8-165,"Artoid Mode Juego de 2 tapetes de cocina de otoño, hojas de arce otoñal, decoración del hogar, alfombras de cocina de bajo perfil para piso, 17 x 29 y 17 x 47 pulgadas",B0D1XP7N2J,34.99,Sin información,300+ comprados el mes pasado,4.0,1,https://m.media-amazon.com/images/I/81va17nTTBL._AC_UL320_.jpg,300.0
https://www.amazon.com/-/es/utensilios-antiadherentes-profesional-herramientas-resistentes/dp/B0CSKRL3VJ/ref=sr_1_166?dib=eyJ2IjoiMSJ9.eIPR2hwBueZUegf5weN3JYWlZ3IZ8IL3_NpfECweoTkJoF1jNDLqZx8PTrxL0V5Zk8FU3P8q9tvPEkFJ4eMjvhWj5n8MIb7NXGSknWnU2hntj3Ob0rQxi-Z85sWmc7q5aKISTxh5iT78bvbWr1V5ASIv-QiKgmCzfTQp4L3DWaFKn7w1w5Ix8-PMZOgtNim5iDUxHZLmb9-UZE4qE_Lee6_yZxE5Rs-x2kPCBb1JEAa4SGuGiBCn85EwCooNeugEBXNsA4fCe43XoAxE8lnZaszLhOJDqJWHJx1JgMbHnKw.oxmfJ6UBfJYHGGVF3NIVBRegu3UlCv5Mgr6oEJH592A&dib_tag=se&keywords=Hogar+y+cocina&qid=1725876542&sr=8-166,"Nutrichef Juego de utensilios de cocina antiadherentes de mármol de 54 piezas, colección profesional de cocina para el hogar con ollas, sartenes y herramientas resistentes al calor",B0CSKRL3VJ,249.99,Sin información,100+ comprados el mes pasado,4.4,82,https://m.media-amazon.com/images/I/81rs5S7pByL._AC_UL320_.jpg,100.0
https://www.amazon.com/-/es/RSSCIIIUL-murci%C3%A9lago-decoraci%C3%B3n-encimera-organizador/dp/B0D86K4WTZ/ref=sr_1_167?dib=eyJ2IjoiMSJ9.eIPR2hwBueZUegf5weN3JYWlZ3IZ8IL3_NpfECweoTkJoF1jNDLqZx8PTrxL0V5Zk8FU3P8q9tvPEkFJ4eMjvhWj5n8MIb7NXGSknWnU2hntj3Ob0rQxi-Z85sWmc7q5aKISTxh5iT78bvbWr1V5ASIv-QiKgmCzfTQp4L3DWaFKn7w1w5Ix8-PMZOgtNim5iDUxHZLmb9-UZE4qE_Lee6_yZxE5Rs-x2kPCBb1JEAa4SGuGiBCn85EwCooNeugEBXNsA4fCe43XoAxE8lnZaszLhOJDqJWHJx1JgMbHnKw.oxmfJ6UBfJYHGGVF3NIVBRegu3UlCv5Mgr6oEJH592A&dib_tag=se&keywords=Hogar+y+cocina&qid=1725876542&sr=8-167,"Soporte para taza de murciélago, 8 ganchos, soporte para tazas de café, decoración gótica del hogar, árbol de taza de café de madera para encimera, soporte para taza de café para organizador",B0D86K4WTZ,24.99,Sin información,200+ comprados el mes pasado,3.0,3,https://m.media-amazon.com/images/I/51y4Ff9n0uL._AC_UL320_.jpg,200.0
https://www.amazon.com/-/es/Skyla-Homes-Cerraduras-seguridad-adhesivos/dp/B0C6VX5QLF/ref=sr_1_168?dib=eyJ2IjoiMSJ9.eIPR2hwBueZUegf5weN3JYWlZ3IZ8IL3_NpfECweoTkJoF1jNDLqZx8PTrxL0V5Zk8FU3P8q9tvPEkFJ4eMjvhWj5n8MIb7NXGSknWnU2hntj3Ob0rQxi-Z85sWmc7q5aKISTxh5iT78bvbWr1V5ASIv-QiKgmCzfTQp4L3DWaFKn7w1w5Ix8-PMZOgtNim5iDUxHZLmb9-UZE4qE_Lee6_yZxE5Rs-x2kPCBb1JEAa4SGuGiBCn85EwCooNeugEBXNsA4fCe43XoAxE8lnZaszLhOJDqJWHJx1JgMbHnKw.oxmfJ6UBfJYHGGVF3NIVBRegu3UlCv5Mgr6oEJH592A&dib_tag=se&keywords=Hogar+y+cocina&qid=1725876542&sr=8-168,"Skyla Homes - Cerraduras de seguridad para niños a prueba de bebés (paquete de 16) – Los cierres adhesivos 3M más seguros, rápidos y fáciles, sin tornillos e imanes, multiusos para muebles, cocina,",B0C6VX5QLF,16.99,Sin información,3 K+ comprados el mes pasado,4.6,31061,https://m.media-amazon.com/images/I/61ToPKDwObL._AC_UL320_.jpg,3000.0
https://www.amazon.com/-/es/Organizador-fregadero-absorbente-organizador-inoxidable/dp/B0C7QVNZ73/ref=sr_1_169?dib=eyJ2IjoiMSJ9.eIPR2hwBueZUegf5weN3JYWlZ3IZ8IL3_NpfECweoTkJoF1jNDLqZx8PTrxL0V5Zk8FU3P8q9tvPEkFJ4eMjvhWj5n8MIb7NXGSknWnU2hntj3Ob0rQxi-Z85sWmc7q5aKISTxh5iT78bvbWr1V5ASIv-QiKgmCzfTQp4L3DWaFKn7w1w5Ix8-PMZOgtNim5iDUxHZLmb9-UZE4qE_Lee6_yZxE5Rs-x2kPCBb1JEAa4SGuGiBCn85EwCooNeugEBXNsA4fCe43XoAxE8lnZaszLhOJDqJWHJx1JgMbHnKw.oxmfJ6UBfJYHGGVF3NIVBRegu3UlCv5Mgr6oEJH592A&dib_tag=se&keywords=Hogar+y+cocina&qid=1725876542&sr=8-169,"Organizador para fregadero de cocina, bandeja de piedra absorbente de agua para fregadero, se seca al instante, organizador de fregadero de cocina con pies de acero inoxidable, bandeja para fregadero",B0C7QVNZ73,29.99,Sin información,300+ comprados el mes pasado,4.4,48,https://m.media-amazon.com/images/I/71Or7qJpu8L._AC_UL320_.jpg,300.0
https://www.amazon.com/-/es/almacenamiento-transparentes-organizador-maquillaje-contenedores/dp/B0CGV3LT2H/ref=sr_1_170?dib=eyJ2IjoiMSJ9.eIPR2hwBueZUegf5weN3JYWlZ3IZ8IL3_NpfECweoTkJoF1jNDLqZx8PTrxL0V5Zk8FU3P8q9tvPEkFJ4eMjvhWj5n8MIb7NXGSknWnU2hntj3Ob0rQxi-Z85sWmc7q5aKISTxh5iT78bvbWr1V5ASIv-QiKgmCzfTQp4L3DWaFKn7w1w5Ix8-PMZOgtNim5iDUxHZLmb9-UZE4qE_Lee6_yZxE5Rs-x2kPCBb1JEAa4SGuGiBCn85EwCooNeugEBXNsA4fCe43XoAxE8lnZaszLhOJDqJWHJx1JgMbHnKw.oxmfJ6UBfJYHGGVF3NIVBRegu3UlCv5Mgr6oEJH592A&dib_tag=se&keywords=Hogar+y+cocina&qid=1725876542&sr=8-170,"Vtopmart Paquete de 8 cajones de almacenamiento apilables transparentes, organizador de maquillaje acrílico de 4.4 pulgadas de alto, contenedores de almacenamiento de plástico para tocador, debajo del",B0CGV3LT2H,60.99,Sin información,400+ comprados el mes pasado,4.6,10678,https://m.media-amazon.com/images/I/71-fdge1Q5L._AC_UL320_.jpg,400.0
https://www.amazon.com/-/es/Voanos-Alfombras-cocina-cami%C3%B3n-pulgadas/dp/B0D5CJ6K2D/ref=sr_1_171?dib=eyJ2IjoiMSJ9.eIPR2hwBueZUegf5weN3JYWlZ3IZ8IL3_NpfECweoTkJoF1jNDLqZx8PTrxL0V5Zk8FU3P8q9tvPEkFJ4eMjvhWj5n8MIb7NXGSknWnU2hntj3Ob0rQxi-Z85sWmc7q5aKISTxh5iT78bvbWr1V5ASIv-QiKgmCzfTQp4L3DWaFKn7w1w5Ix8-PMZOgtNim5iDUxHZLmb9-UZE4qE_Lee6_yZxE5Rs-x2kPCBb1JEAa4SGuGiBCn85EwCooNeugEBXNsA4fCe43XoAxE8lnZaszLhOJDqJWHJx1JgMbHnKw.oxmfJ6UBfJYHGGVF3NIVBRegu3UlCv5Mgr6oEJH592A&dib_tag=se&keywords=Hogar+y+cocina&qid=1725876542&sr=8-171,"Alfombras de cocina de camión de otoño, 17 x 47 pulgadas + 17 x 30 pulgadas",B0D5CJ6K2D,21.65,Sin información,100+ comprados el mes pasado,4.6,47,https://m.media-amazon.com/images/I/81JtjtNsFEL._AC_UL320_.jpg,100.0
https://www.amazon.com/-/es/LXOMILL-Divertidas-decorativas-absorbentes-inauguraci%C3%B3n/dp/B09DKLGKJ9/ref=sr_1_172?dib=eyJ2IjoiMSJ9.eIPR2hwBueZUegf5weN3JYWlZ3IZ8IL3_NpfECweoTkJoF1jNDLqZx8PTrxL0V5Zk8FU3P8q9tvPEkFJ4eMjvhWj5n8MIb7NXGSknWnU2hntj3Ob0rQxi-Z85sWmc7q5aKISTxh5iT78bvbWr1V5ASIv-QiKgmCzfTQp4L3DWaFKn7w1w5Ix8-PMZOgtNim5iDUxHZLmb9-UZE4qE_Lee6_yZxE5Rs-x2kPCBb1JEAa4SGuGiBCn85EwCooNeugEBXNsA4fCe43XoAxE8lnZaszLhOJDqJWHJx1JgMbHnKw.oxmfJ6UBfJYHGGVF3NIVBRegu3UlCv5Mgr6oEJH592A&dib_tag=se&keywords=Hogar+y+cocina&qid=1725876542&sr=8-172,"LXOMILL Divertidas toallas de cocina, bonitos juegos de toallas de cocina decorativas, toallas de mano absorbentes, regalos de inauguración de la casa para el nuevo hogar, mujeres, mamá, juego de 4,",B09DKLGKJ9,17.99,Sin información,200+ comprados el mes pasado,4.8,366,https://m.media-amazon.com/images/I/613bgeSIVpL._AC_UL320_.jpg,200.0
https://www.amazon.com/-/es/reciclaje-contenedor-interiores-reutilizable-extra%C3%ADble/dp/B0D9QNXP89/ref=sr_1_173?dib=eyJ2IjoiMSJ9.eIPR2hwBueZUegf5weN3JYWlZ3IZ8IL3_NpfECweoTkJoF1jNDLqZx8PTrxL0V5Zk8FU3P8q9tvPEkFJ4eMjvhWj5n8MIb7NXGSknWnU2hntj3Ob0rQxi-Z85sWmc7q5aKISTxh5iT78bvbWr1V5ASIv-QiKgmCzfTQp4L3DWaFKn7w1w5Ix8-PMZOgtNim5iDUxHZLmb9-UZE4qE_Lee6_yZxE5Rs-x2kPCBb1JEAa4SGuGiBCn85EwCooNeugEBXNsA4fCe43XoAxE8lnZaszLhOJDqJWHJx1JgMbHnKw.oxmfJ6UBfJYHGGVF3NIVBRegu3UlCv5Mgr6oEJH592A&dib_tag=se&keywords=Hogar+y+cocina&qid=1725876542&sr=8-173,"Papelera de reciclaje, contenedor de reciclaje para cocina y hogar, doble papelera de reciclaje para interiores, 33 galones, 125 L, grande, con tapa, bolsa interior reutilizable extraíble,",B0D9QNXP89,39.99,Sin información,Sin información,4.5,62,https://m.media-amazon.com/images/I/81X3eu19NxL._AC_UL320_.jpg,
