link_producto,producto,asin,precio,precio_original,vendidos_mes_pasado,calificación,num_de_calificaciones,imagen,vendidos_numerico
https://www.amazon.com/-/es/Organizador-almacenamiento-fregadero-organizadores-extra%C3%ADbles/dp/B0C5DBMYZF/ref=sr_1_1?dib=eyJ2IjoiMSJ9.41lVX3WQJwurgZX8MP9GI_U8oBgq0nWvUT_BcT6V66yP9nhMTkv2nM20ei0YtcRRLkVkkSeLEv8xCdT7N6EVlKIietGjeZLCvsnMrUg-9gY0KUiY9dIJbHbDNx5x_6MrP8u9edjyTsumudN7Wo9KF7zGngVHqSD6AnK-njENpcQsknT7HpzKXhvrpJDOEslsBA5vm03oHuV2I3REbxLt62pa-WFgirt1JLIams2fe1aIkrrMYVzM3JGjhA6NQ1FkAFj24lPe-UV3KLqYzu0fIOZlJqwjeFT7tuL4stSjz7w.GB_PT02vbF4YYf1VLhpys1LH6hQAETtHKA0SqKFanoU&dib_tag=se&keywords=Hogar+y+cocina&qid=1725876495&sr=8-1,"REALINN Organizador y almacenamiento para debajo del fregadero, paquete de 2 organizadores extraíbles para fregadero, estantes de almacenamiento, almacenamiento debajo del fregadero para cocina,",B0C5DBMYZF,45.99,Sin información,10 K+ comprados el mes pasado,4.4,7694,https://m.media-amazon.com/images/I/71WSQb57yRL._AC_UL320_.jpg,10000.0
https://www.amazon.com/-/es/Prepared-emergencia-incendios-extinci%C3%B3n-pulgadas/dp/B08TYT543Y/ref=sr_1_2?dib=eyJ2IjoiMSJ9.41lVX3WQJwurgZX8MP9GI_U8oBgq0nWvUT_BcT6V66yP9nhMTkv2nM20ei0YtcRRLkVkkSeLEv8xCdT7N6EVlKIietGjeZLCvsnMrUg-9gY0KUiY9dIJbHbDNx5x_6MrP8u9edjyTsumudN7Wo9KF7zGngVHqSD6AnK-njENpcQsknT7HpzKXhvrpJDOEslsBA5vm03oHuV2I3REbxLt62pa-WFgirt1JLIams2fe1aIkrrMYVzM3JGjhA6NQ1FkAFj24lPe-UV3KLqYzu0fIOZlJqwjeFT7tuL4stSjz7w.GB_PT02vbF4YYf1VLhpys1LH6hQAETtHKA0SqKFanoU&dib_tag=se&keywords=Hogar+y+cocina&qid=1725876495&sr=8-2,"Prepared Hero Manta de emergencia contra incendios, paquete de 2, manta de extinción de incendios para cocina, manta de fuego de 40 x 40 pulgadas para el hogar, manta de fuego de fibra de vidrio",B08TYT543Y,49.99,Sin información,10 K+ comprados el mes pasado,4.8,16011,https://m.media-amazon.com/images/I/71Ja4j-hJML._AC_UL320_.jpg,10000.0
https://www.amazon.com/-/es/picadora-cuchillas-recipiente-art%C3%ADculos-esenciales/dp/B08N9Q24M9/ref=sr_1_3?dib=eyJ2IjoiMSJ9.41lVX3WQJwurgZX8MP9GI_U8oBgq0nWvUT_BcT6V66yP9nhMTkv2nM20ei0YtcRRLkVkkSeLEv8xCdT7N6EVlKIietGjeZLCvsnMrUg-9gY0KUiY9dIJbHbDNx5x_6MrP8u9edjyTsumudN7Wo9KF7zGngVHqSD6AnK-njENpcQsknT7HpzKXhvrpJDOEslsBA5vm03oHuV2I3REbxLt62pa-WFgirt1JLIams2fe1aIkrrMYVzM3JGjhA6NQ1FkAFj24lPe-UV3KLqYzu0fIOZlJqwjeFT7tuL4stSjz7w.GB_PT02vbF4YYf1VLhpys1LH6hQAETtHKA0SqKFanoU&dib_tag=se&keywords=Hogar+y+cocina&qid=1725876495&sr=8-3,"Mueller Pro-Series 10 en 1, picadora de verduras de 8 cuchillas, picadora de cebolla, cortador, cortador, cortador de huevos con recipiente, cortador de papas fritas, artículos esenciales para el",B08N9Q24M9,29.97,Sin información,10 K+ comprados el mes pasado,4.5,29899,https://m.media-amazon.com/images/I/91Ulir9wKXL._AC_UL320_.jpg,10000.0
https://www.amazon.com/-/es/Organizador-fregadero-organizador-almacenamiento-accesorios/dp/B0CJ4WZXQF/ref=sr_1_4?dib=eyJ2IjoiMSJ9.41lVX3WQJwurgZX8MP9GI_U8oBgq0nWvUT_BcT6V66yP9nhMTkv2nM20ei0YtcRRLkVkkSeLEv8xCdT7N6EVlKIietGjeZLCvsnMrUg-9gY0KUiY9dIJbHbDNx5x_6MrP8u9edjyTsumudN7Wo9KF7zGngVHqSD6AnK-njENpcQsknT7HpzKXhvrpJDOEslsBA5vm03oHuV2I3REbxLt62pa-WFgirt1JLIams2fe1aIkrrMYVzM3JGjhA6NQ1FkAFj24lPe-UV3KLqYzu0fIOZlJqwjeFT7tuL4stSjz7w.GB_PT02vbF4YYf1VLhpys1LH6hQAETtHKA0SqKFanoU&dib_tag=se&keywords=Hogar+y+cocina&qid=1725876495&sr=8-4,"Cisily Organizador para fregadero de cocina, soporte de esponja para fregadero de cocina, organizador de fregadero de cocina y almacenamiento con soporte alto para cepillos, accesorios de cocina",B0CJ4WZXQF,24.99,Sin información,6 K+ comprados el mes pasado,4.4,993,https://m.media-amazon.com/images/I/81w9xBQTvZL._AC_UL320_.jpg,6000.0
https://www.amazon.com/-/es/utensilios-antiadherentes-silicona-esp%C3%A1tula-resistente/dp/B08573DQ39/ref=sr_1_5?dib=eyJ2IjoiMSJ9.41lVX3WQJwurgZX8MP9GI_U8oBgq0nWvUT_BcT6V66yP9nhMTkv2nM20ei0YtcRRLkVkkSeLEv8xCdT7N6EVlKIietGjeZLCvsnMrUg-9gY0KUiY9dIJbHbDNx5x_6MrP8u9edjyTsumudN7Wo9KF7zGngVHqSD6AnK-njENpcQsknT7HpzKXhvrpJDOEslsBA5vm03oHuV2I3REbxLt62pa-WFgirt1JLIams2fe1aIkrrMYVzM3JGjhA6NQ1FkAFj24lPe-UV3KLqYzu0fIOZlJqwjeFT7tuL4stSjz7w.GB_PT02vbF4YYf1VLhpys1LH6hQAETtHKA0SqKFanoU&dib_tag=se&keywords=Hogar+y+cocina&qid=1725876495&sr=8-5,"Juego de utensilios de cocina Umite de cocina, 24 piezas antiadherentes de silicona utensilios de cocina juego de espátula con soporte, mango de madera de silicona resistente al calor utensilios de cocina Set (Khaki)",B08573DQ39,18.69,Sin información,10 K+ comprados el mes pasado,4.5,25170,https://m.media-amazon.com/images/I/61SIeOHTpoL._AC_UL320_.jpg,10000.0
https://www.amazon.com/-/es/recipientes-almacenamiento-alimentos-preparaci%C3%B3n-herm%C3%A9ticos/dp/B095CDXSY5/ref=sr_1_6?dib=eyJ2IjoiMSJ9.41lVX3WQJwurgZX8MP9GI_U8oBgq0nWvUT_BcT6V66yP9nhMTkv2nM20ei0YtcRRLkVkkSeLEv8xCdT7N6EVlKIietGjeZLCvsnMrUg-9gY0KUiY9dIJbHbDNx5x_6MrP8u9edjyTsumudN7Wo9KF7zGngVHqSD6AnK-njENpcQsknT7HpzKXhvrpJDOEslsBA5vm03oHuV2I3REbxLt62pa-WFgirt1JLIams2fe1aIkrrMYVzM3JGjhA6NQ1FkAFj24lPe-UV3KLqYzu0fIOZlJqwjeFT7tuL4stSjz7w.GB_PT02vbF4YYf1VLhpys1LH6hQAETtHKA0SqKFanoU&dib_tag=se&keywords=Hogar+y+cocina&qid=1725876495&sr=8-6,"M MCIRCO 30 recipientes de vidrio para almacenamiento de alimentos con tapas de cierre a presión, juego de recipientes de vidrio para preparación de comidas, recipientes herméticos para el almuerzo,",B095CDXSY5,49.99,Sin información,3 K+ comprados el mes pasado,4.5,6282,https://m.media-amazon.com/images/I/71HmcXfkUNL._AC_UL320_.jpg,3000.0
https://www.amazon.com/-/es/HuggieGems-organizadores-magn%C3%A9ticos-almacenamiento-refrigerador/dp/B0C3H9MJQV/ref=sr_1_7?dib=eyJ2IjoiMSJ9.41lVX3WQJwurgZX8MP9GI_U8oBgq0nWvUT_BcT6V66yP9nhMTkv2nM20ei0YtcRRLkVkkSeLEv8xCdT7N6EVlKIietGjeZLCvsnMrUg-9gY0KUiY9dIJbHbDNx5x_6MrP8u9edjyTsumudN7Wo9KF7zGngVHqSD6AnK-njENpcQsknT7HpzKXhvrpJDOEslsBA5vm03oHuV2I3REbxLt62pa-WFgirt1JLIams2fe1aIkrrMYVzM3JGjhA6NQ1FkAFj24lPe-UV3KLqYzu0fIOZlJqwjeFT7tuL4stSjz7w.GB_PT02vbF4YYf1VLhpys1LH6hQAETtHKA0SqKFanoU&dib_tag=se&keywords=Hogar+y+cocina&qid=1725876495&sr=8-7,"Paquete de 4 organizadores magnéticos de almacenamiento de especias para refrigerador y horno, organizadores negros para nevera y almacenamiento",B0C3H9MJQV,19.99,Sin información,10 K+ comprados el mes pasado,4.8,4669,https://m.media-amazon.com/images/I/51imrSup74L._AC_UL320_.jpg,10000.0
https://www.amazon.com/-/es/organizadores-almacenamiento-multiusos-organizaci%C3%B3n-organizador/dp/B0BNQ56MH5/ref=sr_1_8?dib=eyJ2IjoiMSJ9.41lVX3WQJwurgZX8MP9GI_U8oBgq0nWvUT_BcT6V66yP9nhMTkv2nM20ei0YtcRRLkVkkSeLEv8xCdT7N6EVlKIietGjeZLCvsnMrUg-9gY0KUiY9dIJbHbDNx5x_6MrP8u9edjyTsumudN7Wo9KF7zGngVHqSD6AnK-njENpcQsknT7HpzKXhvrpJDOEslsBA5vm03oHuV2I3REbxLt62pa-WFgirt1JLIams2fe1aIkrrMYVzM3JGjhA6NQ1FkAFj24lPe-UV3KLqYzu0fIOZlJqwjeFT7tuL4stSjz7w.GB_PT02vbF4YYf1VLhpys1LH6hQAETtHKA0SqKFanoU&dib_tag=se&keywords=Hogar+y+cocina&qid=1725876495&sr=8-8,"Delamu 2 juegos de organizadores y almacenamiento multiusos de 2 niveles para baño debajo del fregadero, organización apilable de despensa de cocina, organizador extraíble con 8 divisores móviles",B0BNQ56MH5,35.99,Sin información,20 K+ comprados el mes pasado,4.3,3629,https://m.media-amazon.com/images/I/816Vkm+8wmL._AC_UL320_.jpg,20000.0
https://www.amazon.com/-/es/Organizador-organizadores-inoxidable-perforaciones-almacenamiento/dp/B0BLSCY6PR/ref=sr_1_9?dib=eyJ2IjoiMSJ9.41lVX3WQJwurgZX8MP9GI_U8oBgq0nWvUT_BcT6V66yP9nhMTkv2nM20ei0YtcRRLkVkkSeLEv8xCdT7N6EVlKIietGjeZLCvsnMrUg-9gY0KUiY9dIJbHbDNx5x_6MrP8u9edjyTsumudN7Wo9KF7zGngVHqSD6AnK-njENpcQsknT7HpzKXhvrpJDOEslsBA5vm03oHuV2I3REbxLt62pa-WFgirt1JLIams2fe1aIkrrMYVzM3JGjhA6NQ1FkAFj24lPe-UV3KLqYzu0fIOZlJqwjeFT7tuL4stSjz7w.GB_PT02vbF4YYf1VLhpys1LH6hQAETtHKA0SqKFanoU&dib_tag=se&keywords=Hogar+y+cocina&qid=1725876495&sr=8-9,"Organizador adhesivo para ducha, paquete de 5 organizadores de baño de acero inoxidable con gran capacidad, estantes sin perforaciones para almacenamiento de baño y decoración del hogar",B0BLSCY6PR,19.99,Sin información,90 K+ comprados el mes pasado,4.6,26987,https://m.media-amazon.com/images/I/81v4Q00FOyL._AC_UL320_.jpg,90000.0
https://www.amazon.com/-/es/Purificadores-habitaci%C3%B3n-cuadrados-purificador-purificadores/dp/B0BV1HX3GM/ref=sr_1_10?dib=eyJ2IjoiMSJ9.41lVX3WQJwurgZX8MP9GI_U8oBgq0nWvUT_BcT6V66yP9nhMTkv2nM20ei0YtcRRLkVkkSeLEv8xCdT7N6EVlKIietGjeZLCvsnMrUg-9gY0KUiY9dIJbHbDNx5x_6MrP8u9edjyTsumudN7Wo9KF7zGngVHqSD6AnK-njENpcQsknT7HpzKXhvrpJDOEslsBA5vm03oHuV2I3REbxLt62pa-WFgirt1JLIams2fe1aIkrrMYVzM3JGjhA6NQ1FkAFj24lPe-UV3KLqYzu0fIOZlJqwjeFT7tuL4stSjz7w.GB_PT02vbF4YYf1VLhpys1LH6hQAETtHKA0SqKFanoU&dib_tag=se&keywords=Hogar+y+cocina&qid=1725876495&sr=8-10,"Purificadores de aire para el hogar, habitación grande de hasta 1500 pies cuadrados, purificador de aire HEPA Tailulu H13 para caspa de mascotas, humo, olor, polvo, polen, purificadores de aire para",B0BV1HX3GM,,Sin información,500+ comprados el mes pasado,4.5,1142,https://m.media-amazon.com/images/I/718nfflz5PL._AC_UL320_.jpg,500.0
https://www.amazon.com/-/es/Organizador-cubiertos-expandible-utensilios-almacenamiento/dp/B0B6N7CR8C/ref=sr_1_11?dib=eyJ2IjoiMSJ9.41lVX3WQJwurgZX8MP9GI_U8oBgq0nWvUT_BcT6V66yP9nhMTkv2nM20ei0YtcRRLkVkkSeLEv8xCdT7N6EVlKIietGjeZLCvsnMrUg-9gY0KUiY9dIJbHbDNx5x_6MrP8u9edjyTsumudN7Wo9KF7zGngVHqSD6AnK-njENpcQsknT7HpzKXhvrpJDOEslsBA5vm03oHuV2I3REbxLt62pa-WFgirt1JLIams2fe1aIkrrMYVzM3JGjhA6NQ1FkAFj24lPe-UV3KLqYzu0fIOZlJqwjeFT7tuL4stSjz7w.GB_PT02vbF4YYf1VLhpys1LH6hQAETtHKA0SqKFanoU&dib_tag=se&keywords=Hogar+y+cocina&qid=1725876495&sr=8-11,"Lifewit Organizador de cajones de cubiertos, bandeja expandible para utensilios de cocina, sin BPA y soporte para cubiertos, almacenamiento de plástico ajustable para cucharas, tenedores, cuchillos,",B0B6N7CR8C,18.99,Sin información,10 K+ comprados el mes pasado,4.7,11826,https://m.media-amazon.com/images/I/710k5CCqHhL._AC_UL320_.jpg,10000.0
https://www.amazon.com/-/es/fregadero-organizador-escobillas-inoxidable-dispensador/dp/B0C3QZ7SNF/ref=sr_1_12?dib=eyJ2IjoiMSJ9.41lVX3WQJwurgZX8MP9GI_U8oBgq0nWvUT_BcT6V66yP9nhMTkv2nM20ei0YtcRRLkVkkSeLEv8xCdT7N6EVlKIietGjeZLCvsnMrUg-9gY0KUiY9dIJbHbDNx5x_6MrP8u9edjyTsumudN7Wo9KF7zGngVHqSD6AnK-njENpcQsknT7HpzKXhvrpJDOEslsBA5vm03oHuV2I3REbxLt62pa-WFgirt1JLIams2fe1aIkrrMYVzM3JGjhA6NQ1FkAFj24lPe-UV3KLqYzu0fIOZlJqwjeFT7tuL4stSjz7w.GB_PT02vbF4YYf1VLhpys1LH6hQAETtHKA0SqKFanoU&dib_tag=se&keywords=Hogar+y+cocina&qid=1725876495&sr=8-12,"Cisily Soporte de esponja para fregadero de cocina, organizador de fregadero con soporte alto para escobillas, organizador de fregadero de cocina, encimera de acero inoxidable 304, dispensador de",B0C3QZ7SNF,19.99,Sin información,10 K+ comprados el mes pasado,4.6,2114,https://m.media-amazon.com/images/I/817NZ3rrbIL._AC_UL320_.jpg,10000.0
https://www.amazon.com/-/es/herm%C3%A9ticas-inoxidable-accesorios-antideslizante-utensilios/dp/B0BWHJ1FNK/ref=sr_1_13?dib=eyJ2IjoiMSJ9.41lVX3WQJwurgZX8MP9GI_U8oBgq0nWvUT_BcT6V66yP9nhMTkv2nM20ei0YtcRRLkVkkSeLEv8xCdT7N6EVlKIietGjeZLCvsnMrUg-9gY0KUiY9dIJbHbDNx5x_6MrP8u9edjyTsumudN7Wo9KF7zGngVHqSD6AnK-njENpcQsknT7HpzKXhvrpJDOEslsBA5vm03oHuV2I3REbxLt62pa-WFgirt1JLIams2fe1aIkrrMYVzM3JGjhA6NQ1FkAFj24lPe-UV3KLqYzu0fIOZlJqwjeFT7tuL4stSjz7w.GB_PT02vbF4YYf1VLhpys1LH6hQAETtHKA0SqKFanoU&dib_tag=se&keywords=Hogar+y+cocina&qid=1725876495&sr=8-13,"Juego de tazones para mezclar con tapas herméticas, 26 cuencos de acero inoxidable caqui con accesorios para rallador, fondo antideslizante y utensilios de cocina, tamaño 7, 4, 2.5, 2.0, 1.5, 1 cuarto",B0BWHJ1FNK,35.99,Sin información,2 K+ comprados el mes pasado,4.7,1678,https://m.media-amazon.com/images/I/71XR3lo00cL._AC_UL320_.jpg,2000.0
https://www.amazon.com/-/es/profesional-alimentos-multifuncional-zanahorias-recipiente/dp/B09YH5CPQP/ref=sr_1_14?dib=eyJ2IjoiMSJ9.41lVX3WQJwurgZX8MP9GI_U8oBgq0nWvUT_BcT6V66yP9nhMTkv2nM20ei0YtcRRLkVkkSeLEv8xCdT7N6EVlKIietGjeZLCvsnMrUg-9gY0KUiY9dIJbHbDNx5x_6MrP8u9edjyTsumudN7Wo9KF7zGngVHqSD6AnK-njENpcQsknT7HpzKXhvrpJDOEslsBA5vm03oHuV2I3REbxLt62pa-WFgirt1JLIams2fe1aIkrrMYVzM3JGjhA6NQ1FkAFj24lPe-UV3KLqYzu0fIOZlJqwjeFT7tuL4stSjz7w.GB_PT02vbF4YYf1VLhpys1LH6hQAETtHKA0SqKFanoU&dib_tag=se&keywords=Hogar+y+cocina&qid=1725876495&sr=8-14,"Picadora de verduras, cebollas, profesional, de alimentos, multifuncional, 13 en 1, de cocina, con 8 cuchillas, de zanahorias y ajos, con recipiente",B09YH5CPQP,17.85,Sin información,6 K+ comprados el mes pasado,4.2,19833,https://m.media-amazon.com/images/I/81tV-nZg9-L._AC_UL320_.jpg,6000.0
https://www.amazon.com/-/es/Mattitude-antideslizantes-impermeables-ergon%C3%B3micos-c%C3%B3modamente/dp/B09B6TZ5J2/ref=sr_1_15?dib=eyJ2IjoiMSJ9.41lVX3WQJwurgZX8MP9GI_U8oBgq0nWvUT_BcT6V66yP9nhMTkv2nM20ei0YtcRRLkVkkSeLEv8xCdT7N6EVlKIietGjeZLCvsnMrUg-9gY0KUiY9dIJbHbDNx5x_6MrP8u9edjyTsumudN7Wo9KF7zGngVHqSD6AnK-njENpcQsknT7HpzKXhvrpJDOEslsBA5vm03oHuV2I3REbxLt62pa-WFgirt1JLIams2fe1aIkrrMYVzM3JGjhA6NQ1FkAFj24lPe-UV3KLqYzu0fIOZlJqwjeFT7tuL4stSjz7w.GB_PT02vbF4YYf1VLhpys1LH6hQAETtHKA0SqKFanoU&dib_tag=se&keywords=Hogar+y+cocina&qid=1725876495&sr=8-15,"Mattitude - 2 tapetes acolchados antifatiga, antideslizantes, impermeables, ergonómicos para estar de pie cómodamente en la cocina, suelo, oficina, fregadero, lavandería, con un marco negro",B09B6TZ5J2,29.99,Sin información,2 K+ comprados el mes pasado,4.2,20555,https://m.media-amazon.com/images/I/81oMBqfXV1L._AC_UL320_.jpg,2000.0
https://www.amazon.com/-/es/Home-Hero-utensilios-silicona-antiadherentes/dp/B0BZ8FYPN9/ref=sr_1_16?dib=eyJ2IjoiMSJ9.41lVX3WQJwurgZX8MP9GI_U8oBgq0nWvUT_BcT6V66yP9nhMTkv2nM20ei0YtcRRLkVkkSeLEv8xCdT7N6EVlKIietGjeZLCvsnMrUg-9gY0KUiY9dIJbHbDNx5x_6MrP8u9edjyTsumudN7Wo9KF7zGngVHqSD6AnK-njENpcQsknT7HpzKXhvrpJDOEslsBA5vm03oHuV2I3REbxLt62pa-WFgirt1JLIams2fe1aIkrrMYVzM3JGjhA6NQ1FkAFj24lPe-UV3KLqYzu0fIOZlJqwjeFT7tuL4stSjz7w.GB_PT02vbF4YYf1VLhpys1LH6hQAETtHKA0SqKFanoU&dib_tag=se&keywords=Hogar+y+cocina&qid=1725876495&sr=8-16,"Home Hero Juego de utensilios de cocina de 33 piezas, utensilios de cocina de silicona antiadherentes, juego de espátula con soporte, mango de madera de silicona (33 piezas, negro)",B0BZ8FYPN9,24.98,Sin información,100+ comprados el mes pasado,4.6,8755,https://m.media-amazon.com/images/I/71sZyQmuFvL._AC_UL320_.jpg,100.0
https://www.amazon.com/-/es/utensilios-antiadherentes-esp%C3%A1tulas-inoxidable-herramientas/dp/B089FBYT3W/ref=sr_1_17?dib=eyJ2IjoiMSJ9.41lVX3WQJwurgZX8MP9GI_U8oBgq0nWvUT_BcT6V66yP9nhMTkv2nM20ei0YtcRRLkVkkSeLEv8xCdT7N6EVlKIietGjeZLCvsnMrUg-9gY0KUiY9dIJbHbDNx5x_6MrP8u9edjyTsumudN7Wo9KF7zGngVHqSD6AnK-njENpcQsknT7HpzKXhvrpJDOEslsBA5vm03oHuV2I3REbxLt62pa-WFgirt1JLIams2fe1aIkrrMYVzM3JGjhA6NQ1FkAFj24lPe-UV3KLqYzu0fIOZlJqwjeFT7tuL4stSjz7w.GB_PT02vbF4YYf1VLhpys1LH6hQAETtHKA0SqKFanoU&dib_tag=se&keywords=Hogar+y+cocina&qid=1725876495&sr=8-17,"Juego de utensilios de cocina de silicona, 33 utensilios de cocina y cucharas para utensilios de cocina antiadherentes, juego de espátulas de silicona y acero inoxidable, las mejores herramientas de",B089FBYT3W,39.99,Sin información,4 K+ comprados el mes pasado,4.6,4700,https://m.media-amazon.com/images/I/71J6P8L6ORL._AC_UL320_.jpg,4000.0
https://www.amazon.com/-/es/Utopia-Kitchen-Organizador-despensa-paquete/dp/B0BBR3D13T/ref=sr_1_18?dib=eyJ2IjoiMSJ9.41lVX3WQJwurgZX8MP9GI_U8oBgq0nWvUT_BcT6V66yP9nhMTkv2nM20ei0YtcRRLkVkkSeLEv8xCdT7N6EVlKIietGjeZLCvsnMrUg-9gY0KUiY9dIJbHbDNx5x_6MrP8u9edjyTsumudN7Wo9KF7zGngVHqSD6AnK-njENpcQsknT7HpzKXhvrpJDOEslsBA5vm03oHuV2I3REbxLt62pa-WFgirt1JLIams2fe1aIkrrMYVzM3JGjhA6NQ1FkAFj24lPe-UV3KLqYzu0fIOZlJqwjeFT7tuL4stSjz7w.GB_PT02vbF4YYf1VLhpys1LH6hQAETtHKA0SqKFanoU&dib_tag=se&keywords=Hogar+y+cocina&qid=1725876495&sr=8-18,"Utopia Kitchen Organizador de latas para despensa (paquete de 2) – Organizador de almacenamiento de latas de soda, organización de despensa, refrigerador y congelador, capacidad para alimentos y latas",B0BBR3D13T,12.79,Sin información,2 K+ comprados el mes pasado,4.7,4228,https://m.media-amazon.com/images/I/81ODUxjHiDL._AC_UL320_.jpg,2000.0
https://www.amazon.com/-/es/Recipientes-almacenamiento-recipientes-preparaci%C3%B3n-herm%C3%A9ticos/dp/B07Z9Y1677/ref=sr_1_19?dib=eyJ2IjoiMSJ9.41lVX3WQJwurgZX8MP9GI_U8oBgq0nWvUT_BcT6V66yP9nhMTkv2nM20ei0YtcRRLkVkkSeLEv8xCdT7N6EVlKIietGjeZLCvsnMrUg-9gY0KUiY9dIJbHbDNx5x_6MrP8u9edjyTsumudN7Wo9KF7zGngVHqSD6AnK-njENpcQsknT7HpzKXhvrpJDOEslsBA5vm03oHuV2I3REbxLt62pa-WFgirt1JLIams2fe1aIkrrMYVzM3JGjhA6NQ1FkAFj24lPe-UV3KLqYzu0fIOZlJqwjeFT7tuL4stSjz7w.GB_PT02vbF4YYf1VLhpys1LH6hQAETtHKA0SqKFanoU&dib_tag=se&keywords=Hogar+y+cocina&qid=1725876495&sr=8-19,"M MCIRCO Recipientes de almacenamiento de alimentos de vidrio de 24 piezas con tapas de bloqueo a presión mejoradas, juego de recipientes de vidrio para preparación de comidas, recipientes herméticos",B07Z9Y1677,37.99,Sin información,4 K+ comprados el mes pasado,4.6,15274,https://m.media-amazon.com/images/I/81TpJbDFOcL._AC_UL320_.jpg,4000.0
https://www.amazon.com/-/es/recipientes-almacenamiento-herm%C3%A9ticos-preparaci%C3%B3n-reutilizables/dp/B0D7JVYX4C/ref=sr_1_20?dib=eyJ2IjoiMSJ9.41lVX3WQJwurgZX8MP9GI_U8oBgq0nWvUT_BcT6V66yP9nhMTkv2nM20ei0YtcRRLkVkkSeLEv8xCdT7N6EVlKIietGjeZLCvsnMrUg-9gY0KUiY9dIJbHbDNx5x_6MrP8u9edjyTsumudN7Wo9KF7zGngVHqSD6AnK-njENpcQsknT7HpzKXhvrpJDOEslsBA5vm03oHuV2I3REbxLt62pa-WFgirt1JLIams2fe1aIkrrMYVzM3JGjhA6NQ1FkAFj24lPe-UV3KLqYzu0fIOZlJqwjeFT7tuL4stSjz7w.GB_PT02vbF4YYf1VLhpys1LH6hQAETtHKA0SqKFanoU&dib_tag=se&keywords=Hogar+y+cocina&qid=1725876495&sr=8-20,"EATEX Paquete de 12 recipientes de vidrio para almacenamiento de alimentos con tapas, recipientes herméticos de vidrio para preparación de comidas, recipientes de alimentos de vidrio reutilizables con",B0D7JVYX4C,27.9,Sin información,1 K+ comprados el mes pasado,4.7,34,https://m.media-amazon.com/images/I/81m7E5eJPEL._AC_UL320_.jpg,1000.0
https://www.amazon.com/-/es/Escurridor-escurridor-fregadero-coladores-utensilios/dp/B0BK179KPS/ref=sr_1_21?dib=eyJ2IjoiMSJ9.41lVX3WQJwurgZX8MP9GI_U8oBgq0nWvUT_BcT6V66yP9nhMTkv2nM20ei0YtcRRLkVkkSeLEv8xCdT7N6EVlKIietGjeZLCvsnMrUg-9gY0KUiY9dIJbHbDNx5x_6MrP8u9edjyTsumudN7Wo9KF7zGngVHqSD6AnK-njENpcQsknT7HpzKXhvrpJDOEslsBA5vm03oHuV2I3REbxLt62pa-WFgirt1JLIams2fe1aIkrrMYVzM3JGjhA6NQ1FkAFj24lPe-UV3KLqYzu0fIOZlJqwjeFT7tuL4stSjz7w.GB_PT02vbF4YYf1VLhpys1LH6hQAETtHKA0SqKFanoU&dib_tag=se&keywords=Hogar+y+cocina&qid=1725876495&sr=8-21,"Escurridor de platos de hierro con escurridor de platos para encimera de cocina, fregadero, coladores de platos con boquilla ajustable con soporte para utensilios y ranuras para cuchillos,",B0BK179KPS,23.99,Sin información,3 K+ comprados el mes pasado,4.5,1979,https://m.media-amazon.com/images/I/71ilnjzQ9QL._AC_UL320_.jpg,3000.0
https://www.amazon.com/-/es/toallas-esenciales-guantes-resistentes-absorbentes/dp/B0CW3L6KYY/ref=sr_1_22?dib=eyJ2IjoiMSJ9.41lVX3WQJwurgZX8MP9GI_U8oBgq0nWvUT_BcT6V66yP9nhMTkv2nM20ei0YtcRRLkVkkSeLEv8xCdT7N6EVlKIietGjeZLCvsnMrUg-9gY0KUiY9dIJbHbDNx5x_6MrP8u9edjyTsumudN7Wo9KF7zGngVHqSD6AnK-njENpcQsknT7HpzKXhvrpJDOEslsBA5vm03oHuV2I3REbxLt62pa-WFgirt1JLIams2fe1aIkrrMYVzM3JGjhA6NQ1FkAFj24lPe-UV3KLqYzu0fIOZlJqwjeFT7tuL4stSjz7w.GB_PT02vbF4YYf1VLhpys1LH6hQAETtHKA0SqKFanoU&dib_tag=se&keywords=Hogar+y+cocina&qid=1725876495&sr=8-22,"LANE LINEN Juego de toallas de cocina y paños de cocina, 20 piezas esenciales de cocina para el nuevo hogar, guantes de horno resistentes al calor y soporte para ollas, toallas de cocina absorbentes,",B0CW3L6KYY,29.99,Sin información,400+ comprados el mes pasado,4.6,69,https://m.media-amazon.com/images/I/91fcnztMQlL._AC_UL320_.jpg,400.0
https://www.amazon.com/-/es/Portarrollos-papel-Autoadhesivo-perforado-gabinete/dp/B0BSKQW2T2/ref=sr_1_23?dib=eyJ2IjoiMSJ9.41lVX3WQJwurgZX8MP9GI_U8oBgq0nWvUT_BcT6V66yP9nhMTkv2nM20ei0YtcRRLkVkkSeLEv8xCdT7N6EVlKIietGjeZLCvsnMrUg-9gY0KUiY9dIJbHbDNx5x_6MrP8u9edjyTsumudN7Wo9KF7zGngVHqSD6AnK-njENpcQsknT7HpzKXhvrpJDOEslsBA5vm03oHuV2I3REbxLt62pa-WFgirt1JLIams2fe1aIkrrMYVzM3JGjhA6NQ1FkAFj24lPe-UV3KLqYzu0fIOZlJqwjeFT7tuL4stSjz7w.GB_PT02vbF4YYf1VLhpys1LH6hQAETtHKA0SqKFanoU&dib_tag=se&keywords=Hogar+y+cocina&qid=1725876495&sr=8-23,"Portarrollos de papel – Autoadhesivo o perforado, estante de papel negro mate para debajo del gabinete para cocina, soporte de rollo de cocina de aluminio mejorado, más ligero pero más fuerte que el",B0BSKQW2T2,7.99,Sin información,5 K+ comprados el mes pasado,3.8,5405,https://m.media-amazon.com/images/I/71SdoAGoQFL._AC_UL320_.jpg,5000.0
https://www.amazon.com/-/es/Kitchen-Gizmo-silicona-ajustable-sartenes/dp/B01MZ14LJV/ref=sr_1_24?dib=eyJ2IjoiMSJ9.41lVX3WQJwurgZX8MP9GI_U8oBgq0nWvUT_BcT6V66yP9nhMTkv2nM20ei0YtcRRLkVkkSeLEv8xCdT7N6EVlKIietGjeZLCvsnMrUg-9gY0KUiY9dIJbHbDNx5x_6MrP8u9edjyTsumudN7Wo9KF7zGngVHqSD6AnK-njENpcQsknT7HpzKXhvrpJDOEslsBA5vm03oHuV2I3REbxLt62pa-WFgirt1JLIams2fe1aIkrrMYVzM3JGjhA6NQ1FkAFj24lPe-UV3KLqYzu0fIOZlJqwjeFT7tuL4stSjz7w.GB_PT02vbF4YYf1VLhpys1LH6hQAETtHKA0SqKFanoU&dib_tag=se&keywords=Hogar+y+cocina&qid=1725876495&sr=8-24,"Kitchen Gizmo - Colador Snap N Strain de pasta para ollas, colador de silicona ajustable con clip para ollas, sartenes y cuencos, para la cocina, color gris",B01MZ14LJV,12.99,Sin información,5 K+ comprados el mes pasado,4.4,38305,https://m.media-amazon.com/images/I/61Wt0QY-adL._AC_UL320_.jpg,5000.0
https://www.amazon.com/-/es/Zulay-m%C3%BAltiples-utensilios-cucharones-resistente/dp/B07PVBS863/ref=sr_1_25?dib=eyJ2IjoiMSJ9.41lVX3WQJwurgZX8MP9GI_U8oBgq0nWvUT_BcT6V66yP9nhMTkv2nM20ei0YtcRRLkVkkSeLEv8xCdT7N6EVlKIietGjeZLCvsnMrUg-9gY0KUiY9dIJbHbDNx5x_6MrP8u9edjyTsumudN7Wo9KF7zGngVHqSD6AnK-njENpcQsknT7HpzKXhvrpJDOEslsBA5vm03oHuV2I3REbxLt62pa-WFgirt1JLIams2fe1aIkrrMYVzM3JGjhA6NQ1FkAFj24lPe-UV3KLqYzu0fIOZlJqwjeFT7tuL4stSjz7w.GB_PT02vbF4YYf1VLhpys1LH6hQAETtHKA0SqKFanoU&dib_tag=se&keywords=Hogar+y+cocina&qid=1725876495&sr=8-25,"Zulay - Soporte para múltiples utensilios de cocina (cucharones y similares) hecho de silicona, resistente al calor, sin BPA y con bandeja antigoteo; soporte para colocar sobre la encimera, junto a la estufa o en la cocina para cucharas, cucharones, espátulas, pinzas, etc.",B07PVBS863,7.64,Sin información,4 K+ comprados el mes pasado,4.7,39174,https://m.media-amazon.com/images/I/71wvVLKByeL._AC_UL320_.jpg,4000.0
https://www.amazon.com/-/es/Fullstar-Picador-verduras-espiralizador-recipiente/dp/B07WBXRBMN/ref=sr_1_26?dib=eyJ2IjoiMSJ9.41lVX3WQJwurgZX8MP9GI_U8oBgq0nWvUT_BcT6V66yP9nhMTkv2nM20ei0YtcRRLkVkkSeLEv8xCdT7N6EVlKIietGjeZLCvsnMrUg-9gY0KUiY9dIJbHbDNx5x_6MrP8u9edjyTsumudN7Wo9KF7zGngVHqSD6AnK-njENpcQsknT7HpzKXhvrpJDOEslsBA5vm03oHuV2I3REbxLt62pa-WFgirt1JLIams2fe1aIkrrMYVzM3JGjhA6NQ1FkAFj24lPe-UV3KLqYzu0fIOZlJqwjeFT7tuL4stSjz7w.GB_PT02vbF4YYf1VLhpys1LH6hQAETtHKA0SqKFanoU&dib_tag=se&keywords=Hogar+y+cocina&qid=1725876495&sr=8-26,Fullstar Picador de verduras - Picador de alimentos - Picador de cebolla - Cortador de verduras y espiralizador - Picador de verduras con recipiente - Accesorios de cocina - Artículos esenciales para,B07WBXRBMN,33.99,Sin información,2 K+ comprados el mes pasado,4.5,109678,https://m.media-amazon.com/images/I/915Jnh4JIcL._AC_UL320_.jpg,2000.0
https://www.amazon.com/-/es/Organizador-fregadero-organizador-almacenamiento-multiusos/dp/B09YLS37YH/ref=sr_1_27?dib=eyJ2IjoiMSJ9.41lVX3WQJwurgZX8MP9GI_U8oBgq0nWvUT_BcT6V66yP9nhMTkv2nM20ei0YtcRRLkVkkSeLEv8xCdT7N6EVlKIietGjeZLCvsnMrUg-9gY0KUiY9dIJbHbDNx5x_6MrP8u9edjyTsumudN7Wo9KF7zGngVHqSD6AnK-njENpcQsknT7HpzKXhvrpJDOEslsBA5vm03oHuV2I3REbxLt62pa-WFgirt1JLIams2fe1aIkrrMYVzM3JGjhA6NQ1FkAFj24lPe-UV3KLqYzu0fIOZlJqwjeFT7tuL4stSjz7w.GB_PT02vbF4YYf1VLhpys1LH6hQAETtHKA0SqKFanoU&dib_tag=se&keywords=Hogar+y+cocina&qid=1725876495&sr=8-27,"Organizador de 2 niveles para debajo del fregadero, organizador de 2 niveles para debajo del gabinete, cajón organizador con 4 ganchos, almacenamiento multiusos debajo del fregadero para baño,",B09YLS37YH,23.99,Sin información,2 K+ comprados el mes pasado,4.4,2514,https://m.media-amazon.com/images/I/81AyttxDnhL._AC_UL320_.jpg,2000.0
https://www.amazon.com/-/es/Cuisinart-C77BTR-15P-Classic-cuchillos-remaches/dp/B01ALYD1WI/ref=sr_1_28?dib=eyJ2IjoiMSJ9.41lVX3WQJwurgZX8MP9GI_U8oBgq0nWvUT_BcT6V66yP9nhMTkv2nM20ei0YtcRRLkVkkSeLEv8xCdT7N6EVlKIietGjeZLCvsnMrUg-9gY0KUiY9dIJbHbDNx5x_6MrP8u9edjyTsumudN7Wo9KF7zGngVHqSD6AnK-njENpcQsknT7HpzKXhvrpJDOEslsBA5vm03oHuV2I3REbxLt62pa-WFgirt1JLIams2fe1aIkrrMYVzM3JGjhA6NQ1FkAFj24lPe-UV3KLqYzu0fIOZlJqwjeFT7tuL4stSjz7w.GB_PT02vbF4YYf1VLhpys1LH6hQAETtHKA0SqKFanoU&dib_tag=se&keywords=Hogar+y+cocina&qid=1725876495&sr=8-28,"Cuisinart C77BTR-15P Classic Juego de cuchillos de 15 piezas Juego de triple remaches, color negro., talla única",B01ALYD1WI,,Sin información,1 K+ comprados el mes pasado,4.6,11230,https://m.media-amazon.com/images/I/71ZS33DuERL._AC_UL320_.jpg,1000.0
https://www.amazon.com/-/es/Zulay-ergon%C3%B3mico-trituradora-semillas-profesional/dp/B07N7KFHVH/ref=sr_1_29?dib=eyJ2IjoiMSJ9.41lVX3WQJwurgZX8MP9GI_U8oBgq0nWvUT_BcT6V66yP9nhMTkv2nM20ei0YtcRRLkVkkSeLEv8xCdT7N6EVlKIietGjeZLCvsnMrUg-9gY0KUiY9dIJbHbDNx5x_6MrP8u9edjyTsumudN7Wo9KF7zGngVHqSD6AnK-njENpcQsknT7HpzKXhvrpJDOEslsBA5vm03oHuV2I3REbxLt62pa-WFgirt1JLIams2fe1aIkrrMYVzM3JGjhA6NQ1FkAFj24lPe-UV3KLqYzu0fIOZlJqwjeFT7tuL4stSjz7w.GB_PT02vbF4YYf1VLhpys1LH6hQAETtHKA0SqKFanoU&dib_tag=se&keywords=Hogar+y+cocina&qid=1725876495&sr=8-29,"Zulay Prensa de ajo con mango ergonómico suave y fácil de apretar, diseño robusto, extrae más pasta de ajo por diente, trituradora de ajo para nueces y semillas, picadora de ajo y prensa de jengibre profesional",B07N7KFHVH,12.98,Sin información,10 K+ comprados el mes pasado,4.6,23542,https://m.media-amazon.com/images/I/71bwuY90v2L._AC_UL320_.jpg,10000.0
